summary,theme,countries,lemmatized_tokens
Gotti italiano which is situated in amoy street in chinatown had put up a facebook post promoting the event titled hip hop mafioso in the days leading up to the march event its promotional poster featured american hiphop artists snoop dogg and tupac.,Community and Cultural Events,"['China', 'Italy', 'Singapore']","['italian', 'restaurant', 'apologised', 'criticised', 'italy', 'ambassador', 'singapore', 'trying', 'hold', 'mafiathemed', 'night', 'gotti', 'italiano', 'situated', 'amoy', 'street', 'chinatown', 'put', 'facebook', 'post', 'promoting', 'event', 'titled', 'hip', 'hop', 'mafioso', 'day', 'leading', 'march', 'event', 'promotional', 'poster', 'featured', 'american', 'hiphop', 'artist', 'snoop', 'dogg', 'tupac', 'facebook', 'post', 'march', 'ambassador', 'dante', 'brandi', 'said', 'mafia', 'something', 'italy', 'proud', 'people', 'died', 'suffered', 'importantly', 'people', 'still', 'dying', 'suffering', 'fight', 'said', 'mr', 'brandi']"
A halfdozen scholarly groups including the nations two largest associations of professional historians have criticized the museum of the american revolution in philadelphia for renting space to moms for liberty.,Community and Cultural Events,['Mali'],"['halfdozen', 'scholarly', 'group', 'including', 'nation', 'two', 'largest', 'association', 'professional', 'historian', 'criticized', 'museum', 'american', 'revolution', 'philadelphia', 'renting', 'space', 'mom', 'liberty', 'calling', 'dangerous', 'normalization', 'organization', 'support', 'book', 'ban', 'restriction', 'teaching', 'race', 'gender', 'letter', 'museum', 'monday', 'american', 'historical', 'association', 'called', 'museum', 'find', 'legal', 'way', 'cancel', 'rental', 'mom', 'liberty', 'organization', 'vigorously', 'advocated', 'censorship', 'harassment', 'history', 'teacher', 'banning', 'history', 'book', 'library', 'classroom', 'legislation', 'render', 'impossible', 'historian', 'teach', 'professional', 'integrity', 'without', 'risking', 'job', 'loss', 'penalty', 'letter', 'said']"
The national arts council nac supported the renaming of the theatre company. multilingual theatre company the theatre practices artistic director kuo jian hong had said then that no one theatre company can truly say it is singapore theatre company a letter to the st forum dated feb said it was regrettable.,Community and Cultural Events,['Singapore'],"['multilingual', 'theatre', 'company', 'theatre', 'practice', 'artistic', 'director', 'kuo', 'jian', 'hong', 'said', 'one', 'theatre', 'company', 'truly', 'say', 'singapore', 'theatre', 'company', 'letter', 'st', 'forum', 'dated', 'feb', 'said', 'regrettable', 'national', 'art', 'council', 'nac', 'supported', 'renaming', 'theatre', 'company', 'expressed', 'hope', 'nac', 'stc', 'would', 'reconsider', 'name', 'change', 'rama', 'chandran', 'founder', 'director', 'childrens', 'theatre', 'company', 'act', 'theatrics', 'taken', 'facebook', 'criticise', 'name', 'change', 'applauded', 'stcs', 'feb', 'announcement', 'social', 'medium', 'site', 'citing', 'diversity', 'group', 'across', 'affiliation', 'language', 'art', 'form', 'spoke', 'told', 'st', 'episode', 'important', 'theatre', 'community', 'singapore', 'find', 'voice', 'belief', 'voice', 'heard']"
 the weeknd angrily slammed the grammy awards calling them corrupt. The pop star walked away with zero nominations despite having multiple hits this year. The harsh words come less than a year after the recording academys ousted ceo.,community and cultural events,[],"['weeknd', 'angrily', 'slammed', 'grammy', 'award', 'calling', 'corrupt', 'pop', 'star', 'walked', 'away', 'zero', 'nomination', 'despite', 'multiple', 'hit', 'year', 'threetime', 'grammy', 'winner', 'criticised', 'recording', 'academy', 'tuesday', 'nov', 'severely', 'snubbed', 'despite', 'one', 'year', 'biggest', 'album', 'hour', 'tapped', 'super', 'bowl', 'halftime', 'headline', 'performer', 'also', 'topped', 'billboard', 'hot', 'chart', 'blinding', 'light', 'heartless', 'grammys', 'remain', 'corrupt', 'singer', 'said', 'twitter', 'owe', 'fan', 'industry', 'transparency', 'harsh', 'word', 'come', 'less', 'year', 'recording', 'academy', 'ousted', 'ceo', 'accused', 'group', 'determines', 'nomination', 'top', 'category', 'conflict', 'interest', 'engaging', 'transparent', 'selection', 'process']"
 hong kongborn actor and singer nicholas tse revealed on sunday sep that he is in the process of giving up his canadian citizenship. He made the announcement on the china central television cctv programme perception room.,Community and Cultural Events,['China'],"['hong', 'kongborn', 'actor', 'singer', 'nicholas', 'tse', 'revealed', 'sunday', 'sep', 'process', 'giving', 'canadian', 'citizenship', 'made', 'announcement', 'china', 'central', 'television', 'cctv', 'programme', 'perception', 'room', 'yearold', 'tse', 'whose', 'current', 'film', 'raging', 'fire', 'enjoying', 'great', 'success', 'moment', 'said', 'programme', 'come', 'across', 'online', 'comment', 'movie', 'people', 'questioning', 'nationality', 'saying', 'he', 'canadian', 'wondered', 'would', 'say', 'tse', 'said', 'adding', 'comment', 'made', 'heart', 'skip', 'beat', 'said', 'always', 'chinese', 'national', 'born', 'hong', 'kong', 'always', 'wanted', 'spread', 'chinese', 'culture', 'spirit', 'world', 'food', 'music', 'action', 'movie']"
The health sciences authority hsa said the agency issued the warning on nov after a man in his s who had bought euzema confidence revival cream online and used it for a year suffered from purpura.,Consumer Topics  ,['Malaysia'],"['eczema', 'cream', 'touted', 'natural', 'steroidfree', 'contains', 'excessive', 'level', 'arsenic', 'potent', 'steroid', 'health', 'science', 'authority', 'hsa', 'said', 'agency', 'issued', 'warning', 'nov', 'man', 'bought', 'euzema', 'confidence', 'revival', 'cream', 'online', 'used', 'year', 'suffered', 'purpura', 'purplish', 'red', 'spot', 'due', 'small', 'bleeds', 'skin', 'man', 'doctor', 'suspected', 'skin', 'reaction', 'caused', 'mineral', 'containing', 'arsenic', 'reported', 'case', 'hsa', 'malaysiabased', 'retail', 'website', 'euzemacom', 'cream', 'said', 'able', 'beat', 'eczema', 'good', 'powerful', 'natural', 'formula', 'steroidfree', 'contains', 'allnatural', 'herb', 'side', 'effect', 'also', 'sold', 'ecommerce', 'platform', 'carousell']"
Customer ashley beauchamp shared screenshots of the interactions on twitterx which have now been viewed more than one million times. When asked it happily produced a poem about how terrible they are as a company.,Consumer Topics,[],"['another', 'interaction', 'customer', 'asked', 'dpds', 'chatbot', 'write', 'haiku', 'useless', 'dpd', 'responded', 'poem', 'came', 'close', 'quite', 'matching', 'format', 'three', 'line', 'featuring', 'five', 'seven', 'five', 'syllable', 'customer', 'ashley', 'beauchamp', 'shared', 'screenshots', 'interaction', 'twitterx', 'viewed', 'one', 'million', 'time', 'parcel', 'delivery', 'firm', 'dpd', 'replaced', 'customer', 'service', 'chat', 'ai', 'robot', 'thing', 'mr', 'beauchamp', 'wrote', 'utterly', 'useless', 'answering', 'query', 'asked', 'happily', 'produced', 'poem', 'terrible', 'company', 'also', 'swore']"
Daylight coffee is a new entrant at amoy street food centre serving up specialty coffee at hawker prices. following in the footsteps of young hawkerpreneurs behind hipster kopi stalls.,Consumer Topics,[],"['following', 'footstep', 'young', 'hawkerpreneurs', 'behind', 'hipster', 'kopi', 'stall', 'generation', 'coffee', 'roaster', 'mad', 'roaster', 'daylight', 'coffee', 'new', 'entrant', 'amoy', 'street', 'food', 'centre', 'serving', 'specialty', 'coffee', 'hawker', 'price', 'shop', 'opened', 'october', 'cute', 'cartoon', 'logo', 'coffee', 'cup', 'googly', 'eye', 'trendylooking', 'stall', 'owned', 'cousin', 'jass', 'aaron', 'friend', 'han', 'asked', 'theyd', 'inspired', 'similar', 'hawker', 'coffee', 'stall', 'mentioned', 'jass', 'laugh', 'tell', 'dayssg', 'didnt', 'even', 'know', 'existed', 'despite', 'mad', 'roaster', 'located', 'hawker', 'centre', 'explains', 'simply', 'dont', 'care', 'competitor', 'scout', 'competitor', 'area']"
The singapore branch is an seater located in boat quay and is singapores first korean restaurant specialising in andong jjimdak korean braised chicken.,Consumer Topics,['Singapore'],"['actually', 'three', 'sub', 'brand', 'ilmiri', 'company', 'korea', 'singapore', 'outlet', 'take', 'name', 'ilmiri', 'korean', 'fusion', 'cuisine', 'according', 'managing', 'director', 'ilmiri', 'singapore', 'jessie', 'choi', 'wanted', 'give', 'singapore', 'customer', 'option', 'decided', 'combine', 'bestselling', 'menu', 'ilmiri', 'brand', 'singapore', 'branch', 'seater', 'located', 'boat', 'quay', 'singapore', 'first', 'korean', 'restaurant', 'specialising', 'andong', 'jjimdak', 'korean', 'braised', 'chicken', 'apparently', 'originated', 'city', 'andong', 'spicy', 'dish', 'featuring', 'chicken', 'braised', 'sweet', 'savoury', 'soyabased', 'sauce', 'spiked', 'dried', 'fresh', 'whole', 'chilli', 'pepper', 'usually', 'served', 'glass', 'noodle']"
The stall which is called orh huat bak chor mee is located at chinatown complex according to a post by hawker melvin chew on his facebook group hawkers united. It is helmed by the younger brother of wu ling zhen the owner of ah orh seafood restaurant.,Consumer Topics,['China'],"['new', 'bak', 'chor', 'mee', 'minced', 'meat', 'noodle', 'stall', 'try', 'opened', 'family', 'behind', 'famous', 'ah', 'orh', 'seafood', 'restaurant', 'jalan', 'bukit', 'merah', 'stall', 'called', 'orh', 'huat', 'bak', 'chor', 'mee', 'located', 'chinatown', 'complex', 'according', 'post', 'hawker', 'melvin', 'chew', 'facebook', 'group', 'hawker', 'united', 'helmed', 'younger', 'brother', 'wu', 'ling', 'zhen', 'owner', 'ah', 'orh', 'seafood', 'restaurant', 'wu', 'ling', 'zhens', 'youngest', 'son', 'run', 'ah', 'orh', 'teochew', 'fish', 'head', 'steamboat', 'hawker', 'stall', 'bedok', 'stall', 'menu', 'pretty', 'straightforward', 'three', 'type', 'noodle', 'minced', 'meat', 'pig', 'liver', 'fishball', 'bowl', 'upsized', 'portion', 'strangely', 'stall', 'also', 'add', 'beansprouts', 'bak', 'chor', 'mee', 'request', 'omit', 'order']"
Data privacy regulator said the ecommerce giant had violated the blocs signature privacy law known as gdpr in an advertisingrelated decision. The fine was imposed on july and disclosed friday in a financial filing.,Corporate and Business Topics,[],"['amazon', 'amzn', 'face', 'recordbreaking', 'million', 'roughly', 'million', 'fine', 'european', 'union', 'data', 'privacy', 'regulator', 'said', 'ecommerce', 'giant', 'violated', 'bloc', 'signature', 'privacy', 'law', 'known', 'gdpr', 'advertisingrelated', 'decision', 'fine', 'imposed', 'july', 'disclosed', 'friday', 'financial', 'filing', 'largest', 'law', 'threeyear', 'history', 'followed', 'google', 'fine', 'million', 'regulator', 'said', 'amazon', 'processing', 'personal', 'data', 'didnt', 'comply', 'gdpr', 'requirement', 'company', 'acknowledged', 'ordered', 'change', 'business', 'practice', 'amazon', 'said', 'regulatory', 'decision', 'without', 'merit', 'added', 'plan', 'defend', 'vigorously', 'matter']"
 antimonopoly agency kppu ordered seven cooking oil companies on friday to pay fines of up to million for restricting sales amid scarce supplies last year. The seven companies include salim ivomas pratama simpjk a unit of indonesias largest food company indofood group.,Corporate and Business Topics ,['Indonesia'],"['indonesia', 'antimonopoly', 'agency', 'kppu', 'ordered', 'seven', 'cooking', 'oil', 'company', 'friday', 'pay', 'fine', 'million', 'restricting', 'sale', 'amid', 'scarce', 'supply', 'last', 'year', 'kppu', 'launched', 'investigation', 'conduct', 'cooking', 'oil', 'company', 'last', 'year', 'indonesian', 'government', 'placed', 'temporary', 'cap', 'surging', 'retail', 'price', 'essential', 'product', 'later', 'threeweek', 'export', 'ban', 'palm', 'oil', 'indonesia', 'world', 'biggest', 'producer', 'palm', 'oil', 'commonly', 'used', 'cooking', 'oil', 'seven', 'company', 'investigated', 'found', 'guilty', 'limiting', 'distribution', 'branded', 'cooking', 'oil', 'retail', 'price', 'cap', 'place', 'early', 'said', 'dinni', 'melanie', 'chaired', 'kppu', 'panel', 'seven', 'company', 'include', 'salim', 'ivomas', 'pratama', 'simpjk', 'unit', 'indonesia', 'largest', 'food', 'company', 'indofood', 'group', 'well', 'two', 'unit', 'wilmar', 'group']"
The us treasury in october imposed sanctions on key hamas group members operatives and financial facilitators in gaza and elsewhere including sudan trkiye algeria and qatar mr reimer said.,Corporate and Business Topics,"['Algeria', 'Israel', 'Qatar', 'Sudan']","['u', 'treasury', 'october', 'imposed', 'sanction', 'key', 'hamas', 'group', 'member', 'operative', 'financial', 'facilitator', 'gaza', 'elsewhere', 'including', 'sudan', 'trkiye', 'algeria', 'qatar', 'mr', 'reimer', 'said', 'u', 'sanction', 'financial', 'facilitator', 'multiple', 'country', 'pointed', 'vast', 'highly', 'sophisticated', 'network', 'however', 'scale', 'israel', 'campaign', 'aimed', 'destroying', 'militant', 'group', 'hamas', 'control', 'gaza', 'strip', 'main', 'source', 'financing', 'likely', 'greatly', 'diminished', 'conflict', 'said', 'hamas', 'longer', 'de', 'facto', 'authority', 'reduce', 'hamas', 'ability', 'generate', 'revenue', 'could', 'force', 'become', 'guerrillatype', 'organisation', 'said', 'mr', 'reimer']"
 australia was among a host of countries that imposed fresh sanctions on myanmar on february the third anniversary of the military coup the government added five businesses to its list of individuals sanctioned.,Corporate and Business Topics,"['Australia', 'Myanmar']","['australia', 'among', 'host', 'country', 'imposed', 'fresh', 'sanction', 'myanmar', 'february', 'third', 'anniversary', 'military', 'coup', 'government', 'added', 'five', 'business', 'list', 'individual', 'sanctioned', 'since', 'australia', 'targeted', 'two', 'bank', 'help', 'fund', 'myanmar', 'junta', 'arm', 'purchase', 'myanma', 'foreign', 'trade', 'bank', 'myanma', 'investment', 'commercial', 'bank', 'sanction', 'also', 'target', 'three', 'entity', 'asia', 'sun', 'group', 'asia', 'sun', 'trading', 'co', 'ltd', 'cargo', 'link', 'petroleum', 'logistics', 'co', 'ltd', 'role', 'supplying', 'jet', 'fuel', 'security', 'force', 'fuel', 'military', 'used', 'carry', 'unlawfully', 'indiscriminate', 'airstrikes', 'civilian']"
 civil society organisations at the world trade organization wto meeting in the united arab emirates this week have criticized restrictions on their participation. Some of their members had been briefly detained at the talks.,Corporate and Business Topics,[],"['civil', 'society', 'organisation', 'world', 'trade', 'organization', 'wto', 'meeting', 'united', 'arab', 'emirate', 'week', 'criticized', 'restriction', 'participation', 'including', 'alleging', 'member', 'briefly', 'detained', 'talk', 'world', 'sale', 'owinfs', 'network', 'civil', 'society', 'group', 'said', 'wednesday', 'complained', 'wto', 'directorgeneral', 'ngozi', 'okonjoiweala', 'several', 'incident', 'detainment', 'confiscation', 'material', 'heavyhanded', 'restriction', 'lobbying', 'civil', 'society', 'group', 'wto', 'statement', 'said', 'directorgeneral', 'met', 'civil', 'society', 'representative', 'tuesday', 'discus', 'concern', 'since', 'spoken', 'host', 'chair', 'talk', 'identify', 'solution']"
The us on monday mar imposed sanctions on a collection of fintech firms and people mostly in russia accused of enabling sanctions evasion. lawmakers and administration officials have voiced concerns that russia may be using cryptocurrency to avoid pain.,Corporate and Business Topics| Government Actions and Regulations ,['Ukraine'],"['u', 'monday', 'mar', 'imposed', 'sanction', 'collection', 'fintech', 'firm', 'people', 'mostly', 'russia', 'accused', 'enabling', 'sanction', 'evasion', 'treasury', 'office', 'foreign', 'asset', 'control', 'sanctioned', 'firm', 'five', 'owned', 'already', 'sanctioned', 'person', 'people', 'either', 'helped', 'build', 'operate', 'blockchainbased', 'service', 'enabled', 'virtual', 'currency', 'payment', 'russian', 'financial', 'sector', 'thus', 'enabling', 'potential', 'sanction', 'evasion', 'according', 'u', 'treasury', 'included', 'monday', 'sanction', 'group', 'moscowbased', 'fintech', 'company', 'russia', 'uaebased', 'virtual', 'currency', 'exchange', 'among', 'others', 'lawmaker', 'administration', 'official', 'voiced', 'concern', 'russia', 'may', 'using', 'cryptocurrency', 'avoid', 'pain', 'avalanche', 'sanction', 'imposed', 'bank', 'oligarch', 'energy', 'industry', 'response', 'russia', 'february', 'invasion', 'ukraine']"
Singapore and china on thursday dec announced the signing of an upgraded free trade agreement. The deal will give singapore businesses greater access to chinas markets. The agreements were unveiled at the th joint council for bilateral cooperation meeting.,Corporate and Business Topics| international relations and trade,"['China', 'Singapore']","['singapore', 'china', 'thursday', 'dec', 'announced', 'signing', 'upgraded', 'free', 'trade', 'agreement', 'give', 'singapore', 'business', 'greater', 'access', 'china', 'market', 'deal', 'one', 'agreement', 'memorandum', 'understanding', 'mous', 'signed', 'singapore', 'china', 'last', 'year', 'recent', 'year', 'cover', 'area', 'sustainability', 'education', 'trade', 'food', 'security', 'healthcare', 'agreement', 'unveiled', 'th', 'joint', 'council', 'bilateral', 'cooperation', 'jcbc', 'meeting', 'held', 'hilton', 'tianjin', 'ecocity', 'hotel', 'cochaired', 'singapore', 'deputy', 'prime', 'minister', 'lawrence', 'wong', 'chinese', 'vice', 'premier', 'ding', 'xuexiang']"
The economic cooperation between both countries has been on an upward trend. Several singapore companies are already operating in kenya in a variety of sectors from shipping to agribusiness.,Corporate and Business Topics| international relations and trade,"['Kenya', 'Singapore']","['briefing', 'held', 'state', 'house', 'kenya', 'presidential', 'residence', 'nairobi', 'mr', 'lee', 'noted', 'economic', 'cooperation', 'country', 'upward', 'trend', 'kenya', 'one', 'singapore', 'important', 'trading', 'partner', 'subsaharan', 'africa', 'despite', 'covid', 'bilateral', 'trade', 'increased', 'almost', 'quarter', 'yearonyear', 'added', 'mr', 'lee', 'added', 'several', 'singapore', 'company', 'already', 'operating', 'kenya', 'variety', 'sector', 'shipping', 'agribusiness', 'delegation', 'singapore', 'company', 'also', 'accompanied', 'mr', 'lee', 'government', 'official', 'kenya', 'intention', 'pursue', 'opportunity', 'investment', 'partnership', 'kenyan', 'company']"
Nearshoring or friendshoring nearshoring means to locate production close to ones consumers in Mexico. for years the united states top trading partner has been china that has now changed mexico is in top spot as of last year.,Corporate and Business Topics| international relations and trade,"['China', 'Mexico']","['year', 'united', 'state', 'top', 'trading', 'partner', 'china', 'changed', 'mexico', 'top', 'spot', 'last', 'year', 'culmination', 'trend', 'began', 'trump', 'presidency', 'tariff', 'slapped', 'chinese', 'export', 'u', 'also', 'example', 'top', 'trend', 'derisking', 'amidst', 'geopolitical', 'tension', 'nearshoring', 'friendshoring', 'nearshoring', 'mean', 'locate', 'production', 'close', 'one', 'consumer', 'friendshoring', 'policy', 'locating', 'production', 'friendly', 'country', 'mexico', 'result', 'manufacturing', 'boom', 'one', 'company', 'grown', 'example', 'original', 'equipment', 'manufacturer', 'creation', 'technology', 'whose', 'customer', 'include', 'fortune', 'company']"
European Commission announces preliminary charges against amazon. Announcement is preliminary and just one part of the regulatory process. It can take many months or even years before a fine and other penalties are announced.,Corporate and business topics| political topics and protests,[],"['many', 'europe', 'watching', 'see', 'amazon', 'announcement', 'received', 'incoming', 'administration', 'presidentelect', 'joseph', 'r', 'biden', 'jr', 'expected', 'pursue', 'policy', 'limit', 'industry', 'power', 'trump', 'administration', 'criticized', 'm', 'vestager', 'aiming', 'american', 'company', 'like', 'apple', 'even', 'initiated', 'investigation', 'industry', 'amazon', 'case', 'announcement', 'tuesday', 'preliminary', 'one', 'part', 'regulatory', 'process', 'amazon', 'chance', 'respond', 'charge', 'take', 'many', 'month', 'even', 'year', 'fine', 'penalty', 'announced', 'commission', 'also', 'could', 'reach', 'settlement', 'amazon', 'case', 'could', 'dropped']"
 apples iphone sales in china fell per cent yearonyear in the first six weeks of according to research firm counterpoint. The us company faced increased competition from domestic rivals such as huawei.,corporate and business topics| technology and digital trends,['China'],"['apple', 'iphone', 'sale', 'china', 'fell', 'per', 'cent', 'yearonyear', 'first', 'six', 'week', 'according', 'research', 'firm', 'counterpoint', 'u', 'company', 'faced', 'increased', 'competition', 'domestic', 'rival', 'huawei', 'u', 'tech', 'giant', 'chief', 'competitor', 'china', 'premium', 'smartphones', 'huawei', 'saw', 'unit', 'sale', 'rise', 'per', 'cent', 'period', 'according', 'report', 'could', 'fan', 'fear', 'slowdown', 'demand', 'u', 'company', 'whose', 'revenue', 'forecast', 'current', 'quarter', 'u', 'billion', 'wall', 'street', 'expectation', 'share', 'iphone', 'maker', 'per', 'cent', 'premarket', 'trading', 'tuesday', 'lost', 'per', 'cent', 'value', 'far', 'year', 'underperforming', 'big', 'tech', 'peer', 'united', 'state']"
Communications blackout across much of the country in recent weeks in darfur. Some areas havent received any aid since the sudanese military and the rapid support forces rsf a paramilitary went to war almost a year ago.,Disaster and Crisis Management,['Sudan'],"['sudan', 'capital', 'hundred', 'thousand', 'people', 'face', 'daily', 'struggle', 'find', 'food', 'communal', 'kitchen', 'depend', 'threatened', 'dwindling', 'supply', 'communication', 'blackout', 'across', 'much', 'country', 'recent', 'week', 'darfur', 'area', 'havent', 'received', 'aid', 'since', 'sudanese', 'military', 'rapid', 'support', 'force', 'rsf', 'paramilitary', 'went', 'war', 'almost', 'year', 'ago', 'aid', 'agency', 'say', 'unable', 'deliver', 'food', 'many', 'area', 'wartorn', 'country', 'warning', 'hunger', 'set', 'worsen', 'sudan', 'apriljuly', 'lean', 'season', 'approach', 'time', 'year', 'food', 'availability', 'low', 'farmer', 'planting']"
The two singaporeans missing after taiwans magnitude earthquake on wednesday were last seen at a bus station in hualien preparing to board a shuttle bus heading to taroko national park. The missing pair are a married couple.,Disaster and Crisis Management,['Singapore'],"['two', 'singaporean', 'missing', 'taiwan', 'magnitude', 'earthquake', 'wednesday', 'last', 'seen', 'bus', 'station', 'hualien', 'preparing', 'board', 'shuttle', 'bus', 'heading', 'taroko', 'national', 'park', 'taiwan', 'immigration', 'agency', 'said', 'missing', 'pair', 'married', 'couple', 'identified', 'sim', 'hwee', 'kok', 'neo', 'siew', 'choo', 'according', 'facebook', 'group', 'named', 'hualien', 'earthquake', 'relief', 'information', 'cctv', 'footage', 'provided', 'taiwan', 'foreign', 'affair', 'police', 'service', 'saturday', 'apr', 'showed', 'couple', 'standing', 'line', 'bus', 'station', 'hualien', 'city', 'wednesday', 'two', 'hour', 'quake', 'struck']"
 junior college student shannon chong was in class at pm two minutes before the end of a mathematics tutorial when she received a call from her mother. It ended up being the kind of call no one would ever want to receive shannons older sister had been killed in a road accident.,Disaster and Crisis Management,[],"['monday', 'apr', 'jurong', 'pioneer', 'junior', 'college', 'student', 'shannon', 'chong', 'class', 'pm', 'two', 'minute', 'end', 'mathematics', 'tutorial', 'received', 'call', 'mother', 'unusual', 'mother', 'housewife', 'call', 'school', 'hour', 'since', 'shannon', 'j', 'student', 'still', 'class', 'called', 'back', 'tutorial', 'ended', 'minute', 'later', 'ended', 'kind', 'call', 'one', 'would', 'ever', 'want', 'receive', 'shannon', 'older', 'sister', 'killed', 'road', 'accident', 'new', 'zealand', 'mother', 'relayed', 'news', 'phone', 'disbelief', 'suspecting', 'could', 'scam']"
The department of education said it was the largest fine ever imposed for violating the clery act. liberty university also agreed to spend an additional million to improve oncampus safety over the next two years.,Education and Learning ,['Oman'],"['department', 'education', 'imposed', 'record', 'million', 'fine', 'liberty', 'university', 'christian', 'college', 'located', 'virginia', 'violation', 'campus', 'safety', 'law', 'official', 'said', 'tuesday', 'department', 'education', 'said', 'largest', 'fine', 'ever', 'imposed', 'violating', 'clery', 'act', 'requires', 'college', 'maintain', 'disclose', 'campus', 'crime', 'statistic', 'security', 'information', 'liberty', 'university', 'also', 'agreed', 'spend', 'additional', 'million', 'improve', 'oncampus', 'safety', 'next', 'two', 'year', 'department', 'education', 'initiated', 'review', 'receiving', 'complaint', 'alleged', 'college', 'committed', 'violation', 'clery', 'act', 'review', 'also', 'followed', 'lawsuit', 'woman', 'claimed', 'school', 'created', 'environment', 'increased', 'likelihood', 'sexual', 'assault', 'rape', 'case', 'settled']"
