summary,theme,countries,lemmatized_tokens
Enis unit plenitudeenimi and enel eneimi fined more than million euros million for raising charges during a ban on unilateral price hikes. enel was ordered to pay the maximum fine of million euros.,Government Actions and Regulations,['Italy'],"['six', 'italian', 'energy', 'provider', 'including', 'enis', 'unit', 'plenitudeenimi', 'enel', 'eneimi', 'fined', 'million', 'euro', 'million', 'raising', 'charge', 'ban', 'unilateral', 'price', 'hike', 'italy', 'antitrust', 'agency', 'agcm', 'said', 'billing', 'took', 'place', 'august', 'june', 'government', 'banned', 'unilateral', 'price', 'increase', 'gas', 'electricity', 'supply', 'agcm', 'said', 'press', 'release', 'wednesday', 'enel', 'ordered', 'pay', 'maximum', 'fine', 'million', 'euro', 'eni', 'ordered', 'pay', 'million', 'euro', 'raising', 'price', 'million', 'customer', 'without', 'advance', 'warning', 'regional', 'utility', 'acea', 'acemi', 'dolomiti', 'energia', 'fined', 'euro', 'euro', 'respectively', 'giving', 'customer', 'insufficient', 'advance', 'notice', 'price', 'increase']"
The european union imposed sanctions on several senior officials and armed forces officers in myanmar. A military takeover last year set off violence that threatens to destabilise other parts of southeast asia the eu froze the assets of people including investment and foreign economic relations minister kan zaw.,Government Actions and Regulations ,['Myanmar'],"['european', 'union', 'tuesday', 'nov', 'imposed', 'sanction', 'several', 'senior', 'official', 'armed', 'force', 'officer', 'myanmar', 'military', 'takeover', 'last', 'year', 'set', 'violence', 'threatens', 'destabilise', 'part', 'southeast', 'asia', 'eu', 'froze', 'asset', 'people', 'including', 'investment', 'foreign', 'economic', 'relation', 'minister', 'kan', 'zaw', 'chief', 'justice', 'myanmar', 'supreme', 'court', 'top', 'military', 'brass', 'businesspeople', 'linked', 'armed', 'force', 'banned', 'traveling', 'europe', 'nation', 'bloc', 'also', 'froze', 'asset', 'europe', 'myanmar', 'state', 'administration', 'council', 'eu', 'headquarters', 'said', 'statement', 'sac', 'set', 'february', 'following', 'military', 'coup', 'responsible', 'policy', 'activity', 'undermine', 'democracy', 'rule', 'law']"
 european union foreign ministers imposed new sanctions on monday nov on iranian clerics senior officials and top state media employees over the brutal crackdown on protesters.,Government Actions and Regulations ,"['Oman', 'Ukraine']","['european', 'union', 'foreign', 'minister', 'imposed', 'new', 'sanction', 'monday', 'nov', 'iranian', 'cleric', 'senior', 'official', 'top', 'state', 'medium', 'employee', 'brutal', 'crackdown', 'protester', 'also', 'expert', 'believe', 'linked', 'supplying', 'russia', 'explosive', 'drone', 'use', 'war', 'ukraine', 'minister', 'imposed', 'ban', 'travelling', 'europe', 'froze', 'asset', 'individual', 'also', 'froze', 'asset', 'islamic', 'republic', 'iran', 'broadcasting', 'saying', 'medium', 'outlet', 'mouthpiece', 'violent', 'response', 'recent', 'demonstration', 'iran', 'iranian', 'woman', 'men', 'protested', 'government', 'severe', 'restriction', 'daily', 'life', 'since', 'late', 'september', 'death', 'yearold', 'mahsa', 'amini', 'arrested', 'allegedly', 'violating', 'islamic', 'republic', 'strict', 'dress', 'code']"
World bank president david malpass announced plans to step down wednesday finishing his fourth year. malpass had sought to increase economic growth alleviate poverty improve living standards and reduce government debt burdens.,Government Actions and Regulations| environment and climate topics,[],"['world', 'bank', 'president', 'david', 'malpass', 'announced', 'plan', 'step', 'wednesday', 'finishing', 'fourth', 'year', 'amid', 'persistent', 'criticism', 'treasury', 'secretary', 'janet', 'l', 'yellen', 'white', 'house', 'climate', 'adviser', 'john', 'f', 'kerry', 'malpasss', 'level', 'commitment', 'slowing', 'climate', 'change', 'immediately', 'clear', 'replace', 'malpass', 'world', 'bank', 'lends', 'billion', 'dollar', 'developing', 'country', 'plan', 'step', 'june', 'even', 'though', 'term', 'run', 'april', 'malpass', 'appointed', 'president', 'donald', 'trump', 'sought', 'increase', 'economic', 'growth', 'alleviate', 'poverty', 'improve', 'living', 'standard', 'reduce', 'government', 'debt', 'burden', 'according', 'statement', 'released', 'bank']"
More people and companies in russia have been hit by us sanctions in the last decade than any country other than iran. with russia again massing troops and military equipment near the border with ukraine the us and its allies are weighing further sanctions.,Government Actions and Regulations| International Relations and Trade ,['Ukraine'],"['since', 'u', 'imposed', 'travel', 'ban', 'asset', 'freeze', 'economic', 'restriction', 'hundred', 'russian', 'individual', 'company', 'part', 'multinational', 'effort', 'punish', 'president', 'vladimir', 'putin', 'government', 'alleged', 'troublemaking', 'beyond', 'border', 'online', 'russia', 'massing', 'troop', 'military', 'equipment', 'near', 'border', 'ukraine', 'u', 'ally', 'weighing', 'sanction', 'case', 'conflict', 'escalates', 'u', 'sanction', 'place', 'russia', 'people', 'company', 'russia', 'hit', 'u', 'sanction', 'last', 'decade', 'country', 'iran', 'including', 'business', 'magnate', 'close', 'political', 'ally', 'putin', 'banned', 'business', 'u', 'company', 'individual', 'making', 'transaction', 'dollar', 'socalled', 'sectoral', 'sanction', 'corporate', 'titan', 'rosneft', 'gazprom', 'group', 'sberbank', 'vtb', 'group', 'limit', 'ability', 'business', 'abroad', 'restriction', 'added', 'president', 'joe', 'biden', 'stop', 'u', 'financial', 'institution', 'participating', 'primary', 'market', 'russian', 'sovereign', 'debt']"
At present uruguayan beef which constituted twothirds of those exports to china is subject to a per cent tariff by comparison other major beef exporters australia and new zealand which have ftas with china pay tariffs at per cent and per cent uruguay came close to signing an fta with the united states in but its government at the time rejected the deal over fears of expulsion from mercosur.,Government Actions and Regulations| international relations and trade ,"['Australia', 'China', 'Uruguay']","['china', 'accounted', 'per', 'cent', 'uruguay', 'export', 'united', 'nation', 'comtrade', 'data', 'show', 'present', 'uruguayan', 'beef', 'constituted', 'twothirds', 'export', 'china', 'subject', 'per', 'cent', 'tariff', 'comparison', 'major', 'beef', 'exporter', 'australia', 'new', 'zealand', 'ftas', 'china', 'pay', 'tariff', 'per', 'cent', 'per', 'cent', 'uruguay', 'came', 'close', 'signing', 'fta', 'united', 'state', 'government', 'time', 'eventually', 'rejected', 'deal', 'fear', 'expulsion', 'mercosur', 'according', 'study', 'conducted', 'national', 'meat', 'institute', 'uruguay', 'china', 'sign', 'fta', 'uruguay', 'meat', 'industry', 'implement', 'per', 'cent', 'preferential', 'tariff', 'reduce', 'tariff', 'million']"
Taiwan has also applied to join the country comprehensive and progressive agreement for transpacific partnership or cptpp. bilateral trade between taiwan and britain totalled billion pounds us billion in.,Government Actions and Regulations| international relations and trade ,['Canada'],"['taiwan', 'also', 'applied', 'join', 'country', 'comprehensive', 'progressive', 'agreement', 'transpacific', 'partnership', 'cptpp', 'britain', 'formally', 'signed', 'treaty', 'july', 'given', 'status', 'newest', 'member', 'cptpp', 'improving', 'economic', 'relation', 'uk', 'also', 'crucial', 'taiwan', 'application', 'join', 'landmark', 'trade', 'pact', 'deng', 'said', 'bilateral', 'trade', 'taiwan', 'britain', 'totalled', 'billion', 'pound', 'u', 'billion', 'according', 'british', 'government', 'last', 'month', 'canada', 'taiwan', 'completed', 'talk', 'bilateral', 'deal', 'boost', 'foreign', 'investment', 'august', 'u', 'president', 'joe', 'biden', 'signed', 'legislation', 'implementing', 'st', 'century', 'trade', 'initiative', 'united', 'state', 'taiwan']"
The worlds two biggest economies used to be each others largest trading partners. Both governments publicly oppose decoupling. china is now trading more with southeast asia and the us with neighbouring canada and mexico.,Government Actions and Regulations| international relations and trade ,"['Canada', 'China', 'Mexico']","['immoral', 'unsustainable', 'ultimately', 'affect', 'overall', 'interest', 'international', 'community', 'world', 'two', 'biggest', 'economy', 'used', 'others', 'largest', 'trading', 'partner', 'government', 'publicly', 'oppose', 'decoupling', 'china', 'trading', 'southeast', 'asia', 'u', 'neighbouring', 'canada', 'mexico', 'china', 'imposed', 'export', 'curb', 'number', 'critical', 'mineral', 'graphite', 'provides', 'per', 'cent', 'global', 'supply', 'citing', 'national', 'security', 'concern', 'u', 'opposes', 'export', 'control', 'announced', 'china', 'gallium', 'germanium', 'metal', 'used', 'produce', 'semiconductor', 'electronics']"
The bridge was built for billion s billion under turkish president recep tayyip erdogan to link the citys european and asian sides. It adds to a series of potential deals between turkey and the united arab emirates.,Government Actions and Regulations| international relations and trade| infrastructure and development,[],"['bridge', 'built', 'billion', 'billion', 'turkish', 'president', 'recep', 'tayyip', 'erdogan', 'link', 'city', 'european', 'asian', 'side', 'add', 'series', 'potential', 'deal', 'turkey', 'united', 'arab', 'emirate', 'abu', 'dhabi', 'capital', 'uae', 'pledged', 'u', 'billion', 'july', 'support', 'turkey', 'battered', 'economy', 'ankara', 'arab', 'gulf', 'state', 'put', 'aside', 'year', 'animosity', 'uae', 'government', 'statement', 'bloomberg', 'said', 'hoped', 'bilateral', 'trade', 'turkey', 'would', 'double', 'u', 'billion', 'key', 'sector', 'investment', 'included', 'energy', 'logistics', 'tourism', 'agriculture']"
Four people killed during violence orchestrated by supporters of one of the countrys gang leaders who is wanted for extradition by the us. Government declared a state of emergency on sunday after supporters of christopher dudus coke attacked four police stations.,Government Actions and Regulations| Legal and Crime Stories,['Jamaica'],"['large', 'area', 'jamaica', 'capital', 'kingston', 'barricaded', 'security', 'force', 'last', 'night', 'four', 'people', 'killed', 'violence', 'orchestrated', 'supporter', 'one', 'country', 'gang', 'leader', 'wanted', 'extradition', 'u', 'government', 'declared', 'state', 'emergency', 'sunday', 'supporter', 'christopher', 'dudus', 'coke', 'wanted', 'u', 'drug', 'weapon', 'trafficking', 'attacked', 'four', 'police', 'station', 'city', 'burning', 'one', 'ground', 'least', 'two', 'police', 'officer', 'one', 'soldier', 'one', 'civilian', 'killed', 'several', 'others', 'wounded', 'two', 'day', 'violence', 'last', 'night', 'automatic', 'rifle', 'fire', 'continued', 'dark', 'section', 'city', 'remained', 'barricaded', 'army', 'truck', 'attempting', 'clear', 'roadblock', 'red', 'hill', 'district']"
Minister of state for home affairs sun xueling on thursday feb called out metas lack of cooperation with the singapore government when it came to combatting scams meta the parent company of facebook has consistently pushed back against the ministry of home affairs mha recommendations to put in place safeguards against scams on the social media platform ms sun told parliament these recommendations include verifying users against governmentissued ids and offering a secured payment option for marketplace users.,Government Actions and Regulations| Legal and Crime Stories,['Singapore'],"['minister', 'state', 'home', 'affair', 'sun', 'xueling', 'thursday', 'feb', 'called', 'metas', 'lack', 'cooperation', 'singapore', 'government', 'came', 'combatting', 'scam', 'meta', 'parent', 'company', 'facebook', 'consistently', 'pushed', 'back', 'ministry', 'home', 'affair', 'mha', 'recommendation', 'put', 'place', 'safeguard', 'scam', 'social', 'medium', 'platform', 'm', 'sun', 'told', 'parliament', 'recommendation', 'include', 'verifying', 'user', 'governmentissued', 'id', 'offering', 'secured', 'payment', 'option', 'marketplace', 'user', 'total', 'ecommerce', 'scam', 'reported', 'singapore', 'last', 'year', 'double', 'case', 'year', 'victim', 'losing', 'combined', 'million', 'u', 'million', 'close', 'half', 'scam', 'facebook', 'said', 'm', 'sun']"
The panel appointed by facebook to review its policy decisions sharply criticized the company on thursday for not being transparent about an internal program that gives prominent users preferential treatment. The group known as the facebook oversight board said facebook failed to provide relevant information about a system called cross check.,Government Actions and Regulations| media and communication,[],"['panel', 'appointed', 'facebook', 'review', 'policy', 'decision', 'sharply', 'criticized', 'company', 'thursday', 'transparent', 'internal', 'program', 'give', 'prominent', 'user', 'preferential', 'treatment', 'social', 'network', 'group', 'known', 'facebook', 'oversight', 'board', 'said', 'facebook', 'failed', 'provide', 'relevant', 'information', 'system', 'called', 'cross', 'check', 'first', 'disclosed', 'wall', 'street', 'journal', 'exempts', 'highprofile', 'user', 'rule', 'like', 'prohibiting', 'harassment', 'incitement', 'violence', 'others', 'platform', 'must', 'follow', 'board', 'said', 'lack', 'transparency', 'harmed', 'ability', 'rule', 'facebooks', 'decision', 'remove', 'keep', 'online', 'content', 'posted', 'user', 'including', 'company', 'barred', 'former', 'president', 'donald', 'j', 'trump']"
The eruption of violence in equateur is closely linked to the longstanding socioeconomic and political tensions between the lobala and boba tribes. The conflict was sparked by localized tensions over access to fishing ponds between two ethnic groups.,Government Actions and Regulations| Social Issues and Activism,['Congo'],"['eruption', 'violence', 'equateur', 'closely', 'linked', 'longstanding', 'socioeconomic', 'political', 'tension', 'lobala', 'boba', 'tribe', 'exemplifies', 'potential', 'instability', 'outside', 'drcs', 'conflictaffected', 'east', 'also', 'inability', 'congolese', 'government', 'respond', 'crisis', 'without', 'continued', 'support', 'monuc', 'tension', 'boba', 'lobala', 'center', 'around', 'dongo', 'important', 'commercial', 'trade', 'port', 'oubangui', 'river', 'dongo', 'historically', 'belongs', 'lobala', 'year', 'boba', 'increasingly', 'begun', 'control', 'town', 'economically', 'political', 'aspiration', 'growing', 'marginalization', 'lobala', 'ultimately', 'led', 'armed', 'rebellion', 'boba', 'larger', 'conflict', 'sparked', 'localized', 'tension', 'access', 'fishing', 'pond', 'two', 'ethnic', 'group', 'inyelle', 'manzaya', 'whose', 'grievance', 'date', 'back']"
A dentist in anchorage alaska has been convicted on dozens of charges after he was filmed extracting a patients tooth as he stood on a hoverboard. A lawsuit filed by the state in charged lookhart with unlawful dental acts saying his patient care did not meet professional standards lookhart the lawsuit said performed a dental extraction procedure on a sedated patient while riding a hover board.,Healthcare and Medicine ,[],"['dentist', 'anchorage', 'alaska', 'convicted', 'dozen', 'charge', 'filmed', 'extracting', 'patient', 'tooth', 'stood', 'hoverboard', 'according', 'alaska', 'department', 'law', 'seth', 'lookhart', 'convicted', 'felony', 'misdemeanor', 'count', 'anchorage', 'superior', 'court', 'friday', 'judge', 'michael', 'wolverton', 'called', 'evidence', 'presented', 'state', 'fiveweek', 'bench', 'trial', 'overwhelming', 'department', 'law', 'said', 'news', 'release', 'lawsuit', 'filed', 'state', 'charged', 'lookhart', 'unlawful', 'dental', 'act', 'saying', 'patient', 'care', 'meet', 'professional', 'standard', 'lookhart', 'lawsuit', 'said', 'performed', 'dental', 'extraction', 'procedure', 'sedated', 'patient', 'riding', 'hoverboard', 'filmed', 'procedure', 'sent', 'several', 'people']"
 burger lobster singapore was fined by the courts on april for food safety lapses. Five people who ate at the burger lobster outlet in jewel changi airport were hospitalised.,Healthcare and Medicine ,['Singapore'],"['burger', 'lobster', 'singapore', 'fined', 'court', 'april', 'food', 'safety', 'lapse', 'singapore', 'food', 'agency', 'sfa', 'said', 'statement', 'may', 'sfa', 'received', 'report', 'gastroenteritis', 'involving', 'people', 'ate', 'burger', 'lobster', 'outlet', 'jewel', 'changi', 'airport', 'may', 'five', 'hospitalised', 'sfa', 'ministry', 'health', 'found', 'multiple', 'lapse', 'included', 'poor', 'housekeeping', 'cracked', 'kitchen', 'floor', 'tile', 'using', 'dirty', 'oven', 'toaster', 'failure', 'employ', 'food', 'hygiene', 'officer', 'premise', 'interest', 'public', 'health', 'sfa', 'suspended', 'food', 'business', 'operation', 'may', 'july', 'directed', 'burger', 'lobster', 'singapore', 'take', 'necessary', 'measure', 'improve', 'food', 'safety', 'practice', 'cleanliness', 'premise']"
Kobayashi began recalling products on mar after receiving reports of kidney ailments. The factory in osakas yodogawa ward was closed in december due to ageing facilities.,Healthcare and Medicine,['Japan'],"['fully', 'cooperate', 'investigation', 'resolve', 'problem', 'early', 'possible', 'head', 'kobayashis', 'investor', 'relation', 'yuko', 'tomiyama', 'told', 'reporter', 'sunday', 'footage', 'shown', 'public', 'broadcaster', 'nhk', 'health', 'official', 'said', 'ministry', 'would', 'join', 'hand', 'ministry', 'concerned', 'utmost', 'resolve', 'ongoing', 'case', 'asking', 'kobayashi', 'pharma', 'cooperate', 'needed', 'looking', 'case', 'factory', 'osaka', 'yodogawa', 'ward', 'closed', 'december', 'due', 'ageing', 'facility', 'production', 'shifted', 'factory', 'city', 'kinokawa', 'searched', 'sunday', 'japanese', 'medium', 'reported', 'government', 'criticised', 'company', 'taking', 'two', 'month', 'announce', 'health', 'impact', 'product', 'kobayashi', 'began', 'recalling', 'product', 'mar', 'receiving', 'report', 'kidney', 'ailment']"
Homemaker lim sze tein among those who have received the email. News reports and correspondence from cordlife had left her sleepless last night.,healthcare and medicine,[],"['homemaker', 'lim', 'sze', 'tein', 'among', 'received', 'email', 'news', 'report', 'correspondence', 'cordlife', 'left', 'sleepless', 'last', 'night', 'told', 'cna', 'want', 'say', 'fair', 'dont', 'know', 'feel', 'said', 'yearold', 'whose', 'elder', 'daughter', 'cord', 'blood', 'stored', 'cordlife', 'since', 'knew', 'happened', 'since', 'kept', 'quiet', 'unthinkable', 'something', 'like', 'happen', 'seem', 'nonchalant', 'corporate', 'speech', 'disgusting', 'zero', 'empathy']"
The mother of two boys who were then eight and years old misuzu sought a second opinion which brought her to dr see hui ti a medical oncologist at parkway cancer centre pcc dr see patiently explained why the treatment was necessary.,Healthcare and Medicine,[],"['thought', 'raced', 'mind', 'would', 'happen', 'family', 'especially', 'since', 'still', 'young', 'child', 'worried', 'break', 'news', 'upcoming', 'treatment', 'recalled', 'mother', 'two', 'boy', 'eight', 'year', 'old', 'misuzu', 'sought', 'second', 'opinion', 'brought', 'dr', 'see', 'hui', 'ti', 'medical', 'oncologist', 'parkway', 'cancer', 'centre', 'pcc', 'dr', 'see', 'patiently', 'explained', 'treatment', 'necessary', 'based', 'evidencebased', 'medical', 'finding', 'side', 'effect', 'expect', 'control', 'manage', 'treatment', 'period', 'physically', 'mentally', 'said', 'tashiro', 'underwent', 'several', 'round', 'surgery', 'including', 'hysterectomy', 'remove', 'womb', 'followed', 'chemotherapy', 'radiation', 'therapy', 'entire', 'process', 'lasting', 'nine', 'month']"
 iranian court has sentenced prominent filmmaker mohammad rasoulof to jail time for collusion against national security. The director has been sentenced to eight years in prison but will only serve five.,Human Rights and Social Justice ,[],"['iranian', 'court', 'sentenced', 'prominent', 'filmmaker', 'mohammad', 'rasoulof', 'jail', 'time', 'collusion', 'national', 'security', 'lawyer', 'babak', 'paknia', 'said', 'may', 'rasoulofs', 'new', 'drama', 'seed', 'sacred', 'fig', 'due', 'premiere', 'main', 'competition', 'cannes', 'film', 'festival', 'may', 'director', 'sentenced', 'eight', 'year', 'prison', 'serve', 'five', 'mr', 'paknia', 'said', 'post', 'social', 'medium', 'platform', 'x', 'iranian', 'law', 'jail', 'sentence', 'run', 'concurrently', 'according', 'lawyer', 'verdict', 'confirmed', 'appeal', 'court', 'also', 'included', 'flogging', 'fine', 'confiscation', 'property', 'said', 'court', 'found', 'rasoulof', 'guilty', 'collusion', 'national', 'security', 'official', 'medium', 'iran', 'yet', 'publish', 'verdict']"
The european union said on thursday jul it was imposing restrictive measures against individuals and entities for human rights violations in afghanistan south sudan central african republic ukraine and russia. The taliban ministers of education and justice are among the six individuals sanctioned.,Human Rights and Social Justice ,"['Afghanistan', 'Sudan', 'Ukraine']","['european', 'union', 'said', 'thursday', 'jul', 'imposing', 'restrictive', 'measure', 'individual', 'entity', 'human', 'right', 'violation', 'afghanistan', 'south', 'sudan', 'central', 'african', 'republic', 'ukraine', 'russia', 'taliban', 'minister', 'education', 'justice', 'well', 'acting', 'taliban', 'chief', 'justice', 'afghanistan', 'supreme', 'court', 'among', 'six', 'individual', 'sanctioned', 'sexual', 'genderbased', 'violence', 'eu', 'said', 'statement', 'also', 'imposed', 'restrictive', 'measure', 'twelve', 'individual', 'five', 'entity', 'responsible', 'serious', 'human', 'right', 'violation', 'russia', 'referring', 'people', 'misused', 'facial', 'recognition', 'technology', 'arbitrary', 'arrest', 'politically', 'motivated', 'ruling', 'outspoken', 'kremlin', 'critic', 'like', 'alexei', 'navalny', 'vladimir', 'karamurza']"
 britain imposed sanctions on six individuals in charge of the arctic penal colony where russian opposition leader alexei navalny died last week. western leaders have expressed outrage at the news from russian authorities that navalny had fallen unconscious and died in prison.,Human Rights and Social Justice ,[],"['britain', 'wednesday', 'feb', 'imposed', 'sanction', 'six', 'individual', 'charge', 'arctic', 'penal', 'colony', 'russian', 'opposition', 'leader', 'alexei', 'navalny', 'died', 'last', 'week', 'western', 'leader', 'expressed', 'outrage', 'news', 'russian', 'authority', 'navalny', 'president', 'vladimir', 'putin', 'prominent', 'domestic', 'critic', 'fallen', 'unconscious', 'died', 'prison', 'friday', 'sanctioned', 'including', 'head', 'five', 'deputy', 'head', 'penal', 'colony', 'banned', 'uk', 'asset', 'frozen', 'british', 'foreign', 'secretary', 'david', 'cameron', 'said', 'statement', 'clear', 'russian', 'authority', 'saw', 'navalny', 'threat', 'tried', 'repeatedly', 'silence', 'one', 'doubt', 'oppressive', 'nature', 'russian', 'system', 'said']"
 washington us president joe biden on saturday apr recognised the killings of armenians by ottoman forces as genocide a watershed moment for descendants of the hundreds of thousands of dead.,Human Rights and Social Justice,"['Armenia', 'Oman']","['washington', 'u', 'president', 'joe', 'biden', 'saturday', 'apr', 'recognised', 'killing', 'armenian', 'ottoman', 'force', 'genocide', 'watershed', 'moment', 'descendant', 'hundred', 'thousand', 'dead', 'defied', 'decade', 'pressure', 'turkey', 'biden', 'became', 'first', 'u', 'president', 'use', 'word', 'genocide', 'customary', 'statement', 'anniversary', 'day', 'informing', 'turkish', 'president', 'recep', 'tayyip', 'erdogan', 'would', 'go', 'ahead', 'step', 'seeking', 'limit', 'expected', 'furor', 'nato', 'ally', 'remember', 'life', 'died', 'ottomanera', 'armenian', 'genocide', 'recommit', 'preventing', 'atrocity', 'ever', 'occurring', 'biden', 'said']"
The announcement of the ban followed renewed scrutiny of lgbtq rights in malaysia. in a lawsuit filed on jun swatch said it was seeking compensation including in the form of aggravated and exemplary damages.,Human Rights and Social Justice,['Malaysia'],"['lawsuit', 'filed', 'jun', 'swatch', 'said', 'seeking', 'compensation', 'including', 'form', 'aggravated', 'exemplary', 'damage', 'return', 'watch', 'worth', 'rm', 'malay', 'mail', 'reported', 'announcement', 'ban', 'followed', 'renewed', 'scrutiny', 'lgbtq', 'right', 'malaysia', 'government', 'last', 'month', 'halted', 'music', 'festival', 'kuala', 'lumpur', 'pulled', 'plug', 'frontman', 'british', 'pop', 'rock', 'band', 'kissed', 'male', 'bandmate', 'onstage', 'criticised', 'country', 'antilgbtq', 'law', 'discussion', 'lgbtq', 'right', 'also', 'come', 'politically', 'sensitive', 'time', 'multiethnic', 'multifaith', 'malaysia']"
