summary,theme,countries,lemmatized_tokens
 germanys health minister has criticised the roman catholic church for its refusal to bless samesex unions. Health minister jens spahn married his husband daniel funke.,Human Rights and Social Justice,"['Germany', 'Guinea', 'Oman']","['germany', 'health', 'minister', 'criticised', 'roman', 'catholic', 'church', 'refusal', 'bless', 'samesex', 'union', 'say', 'religious', 'faith', 'remains', 'strong', 'health', 'minister', 'jens', 'spahn', 'married', 'husband', 'daniel', 'funke', 'also', 'spahn', 'described', 'relationship', 'church', 'difficult', 'time', 'german', 'news', 'agency', 'dpa', 'reported', 'wednesday', 'aug', 'belief', 'deeply', 'anchored', 'inside', 'dpa', 'quoted', 'spahn', 'telling', 'germany', 'bunte', 'magazine', 'added', 'gay', 'man', 'aware', 'many', 'mistake', 'church', 'made', 'long', 'history', 'priest', 'bless', 'guinea', 'pig', 'motorcycle', 'spahn', 'said', 'two', 'people', 'love', 'believer', 'wishing', 'blessing', 'promise', 'life', 'long', 'rejected', 'church']"
 coreweave has seen a boost from the generative ai boom thanks to its purposebuilt cloud infrastructure at scale. The company has unique access to the most advanced n Nvidia chips that are in short supply giving it an edge in competition with traditional cloud providers.,Infrastructure and Development,[],"['nvidiabacked', 'coreweave', 'seen', 'boost', 'generative', 'ai', 'boom', 'thanks', 'purposebuilt', 'cloud', 'infrastructure', 'scale', 'partnership', 'ai', 'startup', 'cloud', 'provider', 'also', 'competes', 'build', 'cluster', 'power', 'ai', 'workload', 'company', 'unique', 'access', 'advanced', 'nvidia', 'chip', 'short', 'supply', 'giving', 'edge', 'competition', 'traditional', 'cloud', 'provider', 'like', 'microsoft', 'amazon', 'google', 'facing', 'supply', 'restraint', 'working', 'developing', 'chip', 'new', 'financing', 'used', 'acquire', 'graphic', 'processing', 'unit', 'invest', 'data', 'center', 'hiring', 'company', 'said', 'announced', 'billion', 'data', 'center', 'texas', 'last', 'week', 'aim', 'expand', 'u', 'year', 'end']"
A crane at a pub worksite in sengkang toppled and crushed a van. The accident happened at the junction of punggol road and compassvale street.,Infrastructure and Development,['Singapore'],"['singapore', 'van', 'driver', 'taken', 'hospital', 'crane', 'pub', 'worksite', 'sengkang', 'toppled', 'crushed', 'vehicle', 'tuesday', 'apr', 'accident', 'happened', 'junction', 'punggol', 'road', 'compassvale', 'street', 'pm', 'according', 'police', 'crane', 'loaded', 'onto', 'trailer', 'truck', 'toppled', 'onto', 'stationary', 'van', 'beside', 'yearold', 'van', 'driver', 'taken', 'conscious', 'sengkang', 'general', 'hospital', 'crane', 'operator', 'arrested', 'police', 'said', 'adding', 'investigation', 'ongoing', 'national', 'water', 'agency', 'pub', 'said', 'new', 'public', 'sewer', 'construction', 'worksite', 'cna', 'reader', 'said', 'road', 'punggol', 'road', 'compassvale', 'street', 'blocked', 'pm']"
 orto leisure park and groundup initiative gui located at and lorong chencharu respectively will have to be cleared to make way for planned housing developments.,Infrastructure and Development,['Singapore'],"['singapore', 'nestled', 'picturesque', 'lush', 'corner', 'yishun', 'sits', 'hour', 'leisure', 'park', 'house', 'prawning', 'longkang', 'fishing', 'pond', 'sustainability', 'nonprofit', 'run', 'farming', 'cooking', 'programme', 'midnext', 'year', 'ground', 'occupied', 'orto', 'leisure', 'park', 'nonprofit', 'groundup', 'initiative', 'gui', 'located', 'lorong', 'chencharu', 'respectively', 'cleared', 'make', 'way', 'planned', 'housing', 'development', 'bounded', 'khatib', 'camp', 'sembawang', 'road', 'yishun', 'avenue', 'avenue', 'gui', 'orto', 'currently', 'sit', 'area', 'zoned', 'residential', 'use', 'june', 'urban', 'redevelopment', 'authority', 'ura', 'identified', 'chencharu', 'new', 'housing', 'area', 'yishun', 'longterm', 'land', 'use', 'plan']"
 air located at dempsey hill occupies a sq ft space that includes a barracks complex that was once a clubhouse for civil servants. A beckoning lawn and a garden farm where edible plants are cultivated for use in the restaurant.,Infrastructure and Development,['Singapore'],"['air', 'located', 'dempsey', 'hill', 'occupies', 'sq', 'ft', 'space', 'includes', 'barrack', 'complex', 'clubhouse', 'civil', 'servant', 'beckoning', 'lawn', 'garden', 'farm', 'edible', 'plant', 'cultivated', 'use', 'restaurant', 'dempsey', 'ask', 'hidden', 'glade', 'wonder', 'well', 'behind', 'large', 'carpark', 'holland', 'road', 'area', 'youll', 'missed', 'youre', 'busy', 'making', 'way', 'samys', 'curry', 'long', 'beach', 'back', 'march', 'last', 'year', 'sent', 'message', 'singapore', 'hour', 'orlando', 'recounted', 'akili', 'managed', 'secure', 'site', 'flew', 'stood', 'lawn', 'tall', 'grass', 'everywhere', 'per', 'cent', 'initial', 'gut', 'feeling']"
Capitaspring located at market street is a new storey integrated development that was completed in.,Infrastructure and Development,[],"['activity', 'required', 'design', 'incorporate', 'safe', 'catwalk', 'ideally', 'reflective', 'low', 'light', 'emitting', 'tape', 'work', 'platform', 'ensure', 'activity', 'carried', 'safely', 'also', 'deter', 'anyone', 'stepping', 'false', 'ceiling', 'panel', 'proper', 'risk', 'assessment', 'also', 'done', 'prior', 'start', 'work', 'process', 'shared', 'responsibility', 'stakeholder', 'developer', 'contractor', 'designer', 'call', 'everyone', 'part', 'learn', 'past', 'accident', 'prevent', 'future', 'one', 'occurring', 'capitaspring', 'located', 'market', 'street', 'new', 'storey', 'integrated', 'development', 'completed']"
The garden pod at gardens by the bay was officially opened on thursday sep. The hotel offering twostorey suites is set against a panoramic view of the city skyline of downtown marina bay.,Infrastructure and Development,['Singapore'],"['garden', 'pod', 'garden', 'bay', 'officially', 'opened', 'thursday', 'sep', 'hotel', 'offering', 'twostorey', 'suite', 'set', 'panoramic', 'view', 'city', 'skyline', 'downtown', 'marina', 'bay', 'amidst', 'unique', 'foliage', 'serene', 'garden', 'supported', 'singapore', 'tourism', 'board', 'designed', 'president', 'design', 'award', 'winner', 'laud', 'architect', 'garden', 'pod', 'provides', 'unique', 'offering', 'visitor', 'want', 'escape', 'hustle', 'bustle', 'urban', 'living', 'four', 'duplex', 'suite', 'available', 'booking', 'maple', 'jasmine', 'juniper', 'bamboo', 'duplex', 'suite', 'comprising', 'sqm', 'space', 'two', 'level', 'connected', 'sculptural', 'staircase']"
The united states on friday feb issued sweeping sanctions to mark the second anniversary of russias invasion of ukraine targeting over people and entities. The measures targeted the mir payment system russian financial institutions and its militaryindustrial base.,International Relations and Trade ,['Ukraine'],"['united', 'state', 'friday', 'feb', 'issued', 'sweeping', 'sanction', 'mark', 'second', 'anniversary', 'russia', 'invasion', 'ukraine', 'targeting', 'people', 'entity', 'washington', 'seek', 'increase', 'pressure', 'moscow', 'measure', 'targeted', 'mir', 'payment', 'system', 'russian', 'financial', 'institution', 'militaryindustrial', 'base', 'sanction', 'evasion', 'future', 'energy', 'production', 'area', 'also', 'included', 'official', 'involved', 'death', 'russian', 'opposition', 'leader', 'alexei', 'navalny', 'treasury', 'state', 'department', 'said', 'statement', 'action', 'seek', 'hold', 'russia', 'account', 'war', 'death', 'navalny', 'u', 'president', 'joe', 'biden', 'said', 'statement', 'washington', 'look', 'continue', 'support', 'ukraine', 'even', 'face', 'acute', 'shortage', 'ammunition', 'u', 'military', 'aid', 'delayed', 'month', 'congress']"
 european union countries on wednesday feb agreed on a new package of sanctions against russia to target individuals and businesses suspected of assisting moscow in its war against ukraine. Decision coincides with the second anniversary of russias fullscale invasion which began on feb and comes days after the death of russian opposition leader alexei navalny.,International Relations and Trade ,"['Belgium', 'Ukraine']","['european', 'union', 'country', 'wednesday', 'feb', 'agreed', 'new', 'package', 'sanction', 'russia', 'target', 'individual', 'business', 'suspected', 'assisting', 'moscow', 'war', 'ukraine', 'including', 'chinese', 'company', 'decision', 'coincides', 'second', 'anniversary', 'russia', 'fullscale', 'invasion', 'began', 'feb', 'come', 'day', 'death', 'russian', 'opposition', 'leader', 'alexei', 'navalny', 'belgium', 'currently', 'hold', 'rotating', 'presidency', 'nation', 'bloc', 'said', 'package', 'one', 'broadest', 'approved', 'eu', 'according', 'several', 'diplomat', 'eu', 'ambassador', 'member', 'country', 'agreed', 'impose', 'sanction', 'company', 'individual', 'diplomat', 'spoke', 'condition', 'anonymity', 'werent', 'authorised', 'disclose', 'detail', 'sanction', 'yet', 'formally', 'adopted']"
The indian government announced a ban on chinese apps including tiktok which is operated by chinese internet firm bytedance in june. It said the apps were prejudicial to the sovereignty and integrity of india.,International Relations and Trade ,"['China', 'India']","['indian', 'government', 'announced', 'ban', 'chinese', 'apps', 'including', 'tiktok', 'operated', 'chinese', 'internet', 'firm', 'bytedance', 'june', 'relation', 'china', 'deteriorated', 'said', 'apps', 'prejudicial', 'sovereignty', 'integrity', 'india', 'china', 'say', 'new', 'delhi', 'using', 'national', 'security', 'excuse', 'prohibit', 'chinese', 'mobile', 'apps', 'china', 'government', 'thursday', 'criticized', 'indian', 'move', 'ban', 'baidu', 'tiktok', 'popular', 'chinese', 'apps', 'appealed', 'new', 'delhi', 'get', 'economic', 'tie', 'back', 'track', 'china', 'opposes', 'discriminatory', 'restrictive', 'measure', 'chinese', 'company', 'said', 'commerce', 'ministry', 'spokesman', 'gao', 'feng']"
 cuba economy is suffering unprecedented crisis with shortages of basic goods including food fuel and medicine a predicament that many cubans say leaves them with little choice but to leave their home. mexican president andres manuel lopez obrador this week lamented the deaths of cuban migrants in a traffic accident in southern mexico.,International Relations and Trade ,"['Cuba', 'Mexico']","['cuba', 'economy', 'suffering', 'unprecedented', 'crisis', 'shortage', 'basic', 'good', 'including', 'food', 'fuel', 'medicine', 'predicament', 'many', 'cuban', 'say', 'leaf', 'little', 'choice', 'leave', 'home', 'mexican', 'president', 'andres', 'manuel', 'lopez', 'obrador', 'week', 'lamented', 'death', 'cuban', 'migrant', 'traffic', 'accident', 'southern', 'mexico', 'calling', 'country', 'address', 'root', 'cause', 'driving', 'migration', 'lopez', 'obrador', 'key', 'ally', 'cuba', 'region', 'said', 'monday', 'sanction', 'blockade', 'maintained', 'apparent', 'reference', 'u', 'embargo', 'cuba', 'help', 'country', 'poverty', 'said']"
 chinas foreign ministry said on friday aug it had imposed sanctions on lithuanian deputy transport and communications minister agne vaiciukeviciute.,International Relations and Trade,"['China', 'Lithuania']","['china', 'foreign', 'ministry', 'said', 'friday', 'aug', 'imposed', 'sanction', 'lithuanian', 'deputy', 'transport', 'communication', 'minister', 'agne', 'vaiciukeviciute', 'visiting', 'taiwan', 'latest', 'development', 'beijing', 'diplomatic', 'row', 'european', 'union', 'country', 'foreign', 'ministry', 'said', 'china', 'would', 'also', 'suspend', 'engagement', 'vaiciukeviciutes', 'ministry', 'cooperation', 'transportation', 'lithuania', 'small', 'baltic', 'republic', 'lithuania', 'ministry', 'transport', 'communication', 'said', 'regretted', 'china', 'announcement', 'beijing', 'choosing', 'continue', 'intensify', 'course', 'illegal', 'action', 'eu', 'member', 'state', 'lithuanian', 'ministry', 'said', 'statement', 'reuters', 'conducive', 'development', 'china', 'relation', 'democratic', 'world', 'also', 'revers', 'beijing', 'declared', 'policy', 'far', 'hindering', 'development', 'mutually', 'beneficial', 'relationship', 'taiwan', 'one', 'world', 'progressive', 'economy']"
Singapore started importing renewable energy from laos through thailand and malaysia on thursday jun. This is the first multilateral crossborder electricity trade involving four asean countries.,International Relations and Trade| environment and climate topics,"['Malaysia', 'Singapore', 'Thailand']","['singapore', 'started', 'importing', 'renewable', 'energy', 'lao', 'thailand', 'malaysia', 'thursday', 'jun', 'initial', 'twoyear', 'power', 'purchase', 'agreement', 'signed', 'keppel', 'electric', 'lao', 'stateowned', 'electricite', 'du', 'lao', 'edl', 'lao', 'pdrthailandmalaysiasingapore', 'power', 'integration', 'project', 'ltmspip', 'import', 'megawatt', 'mw', 'renewable', 'hydropower', 'using', 'existing', 'interconnection', 'marking', 'first', 'multilateral', 'crossborder', 'electricity', 'trade', 'involving', 'four', 'asean', 'country', 'equivalent', 'per', 'cent', 'singapore', 'peak', 'electricity', 'demand', 'enough', 'power', 'fourroom', 'hdb', 'flat', 'year', 'also', 'first', 'renewable', 'energy', 'import', 'singapore', 'said', 'keppel', 'electric', 'edl', 'laotian', 'ministry', 'energy', 'mine', 'energy', 'market', 'authority', 'ema', 'joint', 'news', 'release']"
Trade between turkey and iran peaked in at nearly billion but has since fallen it stood at billion in according to turkish trade minister omer bolat down from around billion a year earlier. The issue of opening new border gates with iran is also on our agenda.,international relations and trade| government actions and regulations,[],"['erdogan', 'speaking', 'turkishiranian', 'business', 'council', 'meeting', 'alongside', 'iran', 'president', 'ebrahim', 'raisi', 'blamed', 'international', 'sanction', 'tehran', 'covid', 'pandemic', 'decline', 'trade', 'volume', 'trade', 'turkey', 'iran', 'peaked', 'nearly', 'billion', 'since', 'fallen', 'stood', 'billion', 'according', 'turkish', 'trade', 'minister', 'omer', 'bolat', 'around', 'billion', 'year', 'earlier', 'issue', 'opening', 'new', 'border', 'gate', 'iran', 'also', 'agenda', 'effort', 'establish', 'trade', 'centre', 'border', 'area', 'increasing', 'economic', 'development', 'border', 'province', 'continue', 'said', 'turkey', 'nato', 'ally', 'iran', 'currently', 'four', 'border', 'crossing', 'one', 'gate', 'gurbulakbazergan', 'region', 'construction', 'since']"
A stream of people some fearing air strikes queued at a border crossing to flee myanmar early on friday apr. A day after the strategically vital town of myawaddy near thailand fell to antijunta resistance.,International Relations and Trade| military,"['Myanmar', 'Thailand']","['mae', 'sot', 'thailand', 'stream', 'people', 'fearing', 'air', 'strike', 'queued', 'border', 'crossing', 'flee', 'myanmar', 'early', 'friday', 'apr', 'day', 'strategically', 'vital', 'town', 'myawaddy', 'near', 'thailand', 'fell', 'antijunta', 'resistance', 'gaining', 'strength', 'loss', 'town', 'robs', 'junta', 'already', 'grappling', 'economy', 'free', 'fall', 'vital', 'earnings', 'border', 'trade', 'strengthening', 'rebel', 'group', 'karen', 'national', 'union', 'knu', 'led', 'assault', 'myawaddy', 'analyst', 'say', 'afraid', 'air', 'strike', 'said', 'moe', 'moe', 'thet', 'san', 'myawaddy', 'resident', 'crossed', 'thailand', 'son', 'five', 'year', 'old']"
Strikes by air tanks and artillery rocked sudans capital khartoum and the adjacent city of bahri on friday apr witnesses said mocking a hour truce extension announced by the army and a rival paramilitary force hundreds have been killed and tens of thousands have fled for their lives.,International Relations and Trade| military,['Sudan'],"['khartoum', 'strike', 'air', 'tank', 'artillery', 'rocked', 'sudan', 'capital', 'khartoum', 'adjacent', 'city', 'bahri', 'friday', 'apr', 'witness', 'said', 'mocking', 'hour', 'truce', 'extension', 'announced', 'army', 'rival', 'paramilitary', 'force', 'hundred', 'killed', 'ten', 'thousand', 'fled', 'life', 'power', 'struggle', 'army', 'rapid', 'support', 'force', 'rsf', 'erupted', 'apr', 'disabled', 'internationally', 'backed', 'transition', 'toward', 'democratic', 'election', 'fighting', 'also', 'reawakened', 'twodecadeold', 'conflict', 'western', 'darfur', 'region', 'score', 'died', 'week', 'khartoum', 'area', 'heavy', 'gunfire', 'detonation', 'rattled', 'residential', 'neighbourhood', 'plume', 'smoke', 'rose', 'bahri']"
The us and uk have over the past few weeks carried out a number of joint military strikes on houthi targets in yemen. The strikes have been in response to attacks by the iranbacked  rebels on both commercial and state vessels in the red sea.,International Relations and Trade| military,['Yemen'],"['brighton', 'england', 'u', 'uk', 'past', 'week', 'carried', 'number', 'joint', 'military', 'strike', 'houthi', 'target', 'yemen', 'strike', 'response', 'attack', 'iranbacked', 'houthi', 'rebel', 'commercial', 'state', 'vessel', 'red', 'sea', 'since', 'conflict', 'broke', 'gaza', 'oct', 'u', 'uk', 'justified', 'strike', 'invoking', 'right', 'selfdefence', 'enshrined', 'article', 'united', 'nation', 'charter', 'right', 'also', 'found', 'within', 'customary', 'international', 'law', 'together', 'two', 'source', 'provide', 'right', 'exists', 'armed', 'attack', 'occurs', 'state', 'action', 'taken', 'necessary', 'proportionate']"
The strikes are believed to be just the first in a multitiered response by president joe bidens administration in response to the attack last weekend carried out by iranbacked militants. The strikes did not target any locations inside iran they are likely to increase concern about tensions escalating in the middle east.,International Relations and Trade| military,"['Iraq', 'Israel', 'Jordan']","['washington', 'united', 'state', 'carried', 'retaliatory', 'air', 'strike', 'friday', 'feb', 'iraq', 'syria', 'target', 'linked', 'iran', 'revolutionary', 'guard', 'irgc', 'militia', 'back', 'u', 'military', 'said', 'deadly', 'attack', 'jordan', 'killed', 'three', 'u', 'troop', 'injured', 'others', 'strike', 'believed', 'first', 'multitiered', 'response', 'president', 'joe', 'bidens', 'administration', 'response', 'attack', 'last', 'weekend', 'carried', 'iranbacked', 'militant', 'u', 'strike', 'target', 'location', 'inside', 'iran', 'likely', 'increase', 'concern', 'tension', 'escalating', 'middle', 'east', 'israel', 'threemonthold', 'war', 'palestinian', 'hamas', 'militant', 'gaza']"
Twenty years after the united states invasion of iraq analysts say the conflict has drastically altered how the us views warfare and has changed its bootsontheground strategy.,International Relations and Trade| military,['Iraq'],"['washington', 'twenty', 'year', 'united', 'state', 'invasion', 'iraq', 'analyst', 'say', 'conflict', 'drastically', 'altered', 'u', 'view', 'warfare', 'changed', 'bootsontheground', 'strategy', 'search', 'weapon', 'mass', 'destruction', 'wmd', 'along', 'former', 'iraqi', 'president', 'saddam', 'hussein', 'purported', 'tie', 'terrorist', 'group', 'pretext', 'justification', 'campaign', 'thenus', 'president', 'george', 'w', 'bush', 'called', 'military', 'operation', 'mission', 'free', 'iraqi', 'people', 'prevent', 'saddam', 'regime', 'threatening', 'u', 'world', 'destructive', 'weapon', 'fellow', 'citizen', 'hour', 'american', 'coalition', 'force', 'early', 'stage', 'military', 'operation', 'disarm', 'iraq', 'free', 'people', 'defend', 'world', 'grave', 'danger', 'said', 'bush', 'march', 'day', 'usled', 'invasion', 'iraq']"
Starbucks violated federal labor law when it increased wages and offered new perks and benefits only to nonunion employees a national labor relations board judge found thursday.,Labor and Employment Issues ,[],"['starbucks', 'violated', 'federal', 'labor', 'law', 'increased', 'wage', 'offered', 'new', 'perk', 'benefit', 'nonunion', 'employee', 'national', 'labor', 'relation', 'board', 'judge', 'found', 'thursday', 'decision', 'latest', 'series', 'nlrb', 'ruling', 'finding', 'starbucks', 'violated', 'labor', 'law', 'effort', 'stop', 'union', 'forming', 'coffee', 'shop', 'issue', 'heart', 'case', 'whether', 'current', 'board', 'law', 'starbucks', 'entitled', 'explicitly', 'reward', 'employee', 'participating', 'union', 'activity', 'falsely', 'telling', 'worker', 'federal', 'labor', 'law', 'forced', 'take', 'action', 'wrote', 'administrative', 'law', 'judge', 'maralouise', 'anzalone']"
Two yearold children were found working at a louisville mcdonalds restaurant sometimes until am the us department of labor said t Tuesday. The revelation was part of an investigation into the child labor law violations in the southeast.,Labor and Employment Issues,['India'],"['two', 'yearold', 'child', 'found', 'working', 'louisville', 'mcdonalds', 'restaurant', 'sometimes', 'u', 'department', 'labor', 'said', 'tuesday', 'revelation', 'part', 'investigation', 'child', 'labor', 'law', 'violation', 'southeast', 'agency', 'also', 'found', 'three', 'franchisees', 'mcdonalds', 'location', 'kentucky', 'indiana', 'maryland', 'ohio', 'employed', 'child', 'work', 'legally', 'permitted', 'hour', 'perform', 'task', 'prohibited', 'law', 'young', 'worker', 'labor', 'department', 'said', 'statement', 'investigator', 'department', 'wage', 'hour', 'division', 'found', 'two', 'yearold', 'worker', 'louisville', 'mcdonalds', 'restaurant', 'among', 'many', 'violation', 'federal', 'labor', 'law', 'committed', 'three', 'kentucky', 'mcdonalds', 'franchise', 'operator', 'release', 'said', 'investigator', 'also', 'determined', 'two', 'yearold', 'child', 'employed', 'paid', 'sometimes', 'worked', 'late']"
 red crowns senior living has been fined after the ministry of manpower mom found that the company had engaged in illegal employment practices. The assisted coliving agency illegally hired and deployed migrant domestic workers to provide caregiving services allowing it to circumvent its foreign manpower quota and pay lower levy rates.,Labor and Employment Issues,[],"['red', 'crown', 'senior', 'living', 'fined', 'ministry', 'manpower', 'mom', 'found', 'company', 'engaged', 'illegal', 'employment', 'practice', 'assisted', 'coliving', 'agency', 'illegally', 'hired', 'deployed', 'migrant', 'domestic', 'worker', 'provide', 'caregiving', 'service', 'allowing', 'circumvent', 'foreign', 'manpower', 'quota', 'pay', 'lower', 'levy', 'rate', 'ministry', 'told', 'cna', 'monday', 'apr', 'red', 'crown', 'also', 'placed', 'legal', 'responsibility', 'elderly', 'client', 'employed', 'migrant', 'domestic', 'worker', 'control', 'work', 'welfare', 'mom', 'added', 'company', 'director', 'issued', 'composition', 'fine', 'offence', 'employment', 'foreign', 'manpower', 'act', 'ministry', 'said', 'without', 'mentioning', 'exact', 'amount', 'fined']"
A reuters investigation found that musks rocket company disregarded workersafety regulations and standard practices at its facilities nationwide. The news organization documented at least previously unreported injuries of spacex workers since spacex has not responded to questions about any of the incidents.,Labor and Employment Issues,[],"['reuters', 'investigation', 'late', 'last', 'year', 'found', 'musk', 'rocket', 'company', 'disregarded', 'workersafety', 'regulation', 'standard', 'practice', 'facility', 'nationwide', 'interview', 'government', 'record', 'news', 'organization', 'documented', 'least', 'previously', 'unreported', 'injury', 'spacex', 'worker', 'since', 'spacex', 'responded', 'reuters', 'question', 'incident', 'including', 'death', 'one', 'worker', 'injury', 'another', 'remains', 'coma', 'skull', 'fractured', 'rocket', 'engine', 'malfunction', 'company', 'also', 'respond', 'request', 'comment', 'new', 'safety', 'fine', 'inspector', 'washington', 'state', 'department', 'labor', 'industry', 'discovered', 'new', 'safety', 'violation', 'company', 'redmond', 'washington', 'site', 'last', 'december', 'visit', 'prompted', 'worker', 'complaint', 'according', 'state', 'inspection', 'record', 'obtained', 'reuters', 'open', 'record', 'request', 'agency', 'spokesperson', 'said', 'spacex', 'still', 'appeal', 'decision']"
 sonos first sued google for patent infringement in los angeles and at the us international trade commission in accusing the tech giant of copying its technology. the companies previously worked together to integrate mountain view californiabased googles streaming music service into sonos products.,Labor and Employment Issues,[],"['company', 'previously', 'worked', 'together', 'integrate', 'mountain', 'view', 'californiabased', 'google', 'streaming', 'music', 'service', 'sonos', 'product', 'sonos', 'first', 'sued', 'google', 'patent', 'infringement', 'los', 'angeles', 'u', 'international', 'trade', 'commission', 'accusing', 'tech', 'giant', 'copying', 'technology', 'collaboration', 'device', 'including', 'google', 'home', 'chromecast', 'audio', 'sonos', 'last', 'year', 'limited', 'import', 'ban', 'google', 'device', 'itc', 'google', 'appealed', 'google', 'countered', 'patent', 'lawsuit', 'california', 'itc', 'accusing', 'sonos', 'incorporating', 'tech', 'company', 'technology', 'smart', 'speaker', 'sonos', 'called', 'google', 'lawsuit', 'intimidation', 'tactic', 'grind', 'smaller', 'competitor']"
