summary,theme,countries,lemmatized_tokens
Zhang ruijin was also ordered to forfeit around s million of his assets to the state this amounts to about per cent of the s million worth of assets originally seized by the police. He is the fifth of accused persons to be dealt with in relation to the case.,Legal and Crime Stories ,['Singapore'],"['singapore', 'yearold', 'man', 'linked', 'singapore', 'largest', 'money', 'laundering', 'case', 'sentenced', 'month', 'jail', 'tuesday', 'apr', 'zhang', 'ruijin', 'also', 'ordered', 'forfeit', 'around', 'million', 'asset', 'state', 'amount', 'per', 'cent', 'million', 'worth', 'asset', 'originally', 'seized', 'police', 'fifth', 'accused', 'person', 'dealt', 'relation', 'case', 'zhang', 'pleaded', 'guilty', 'tuesday', 'two', 'count', 'forgeryrelated', 'offence', 'one', 'failing', 'satisfactorily', 'account', 'property', 'reasonably', 'suspected', 'benefit', 'criminal', 'conduct']"
Former austrian chancellor sebastian kurz has been convicted of making false statements to a parliamentary inquiry. The case marked the first time in more than years that a former Austrian chancellor had stood trial.,Legal and Crime Stories ,['Austria'],"['twelve', 'day', 'deliberation', 'vienna', 'court', 'delivered', 'verdict', 'trial', 'former', 'austrian', 'chancellor', 'sebastian', 'kurz', 'convicted', 'making', 'false', 'statement', 'parliamentary', 'inquiry', 'verdict', 'vienna', 'criminal', 'court', 'followed', 'fourmonth', 'trial', 'case', 'marked', 'first', 'time', 'year', 'former', 'austrian', 'chancellor', 'stood', 'trial', 'given', 'eightmonth', 'suspended', 'sentence', 'kurz', 'hailed', 'wunderkind', 'austrian', 'people', 'party', 'resigned', 'following', 'separate', 'corruption', 'probe', 'prosecutor', 'trial', 'opened', 'october', 'accused', 'yearold', 'giving', 'false', 'evidence', 'june', 'inquiry', 'regarding', 'role', 'setting', 'holding', 'company', 'named', 'oebag']"
Former member of parliament mp dominik feri sentenced to three years in prison for two rapes and one attempted rape. feri has also been ordered to pay a total of over czk as financial compensation to his victims.,Legal and Crime Stories ,[],"['prague', 'district', 'court', 'morning', 'sentenced', 'former', 'member', 'parliament', 'mp', 'dominik', 'feri', 'three', 'year', 'prison', 'two', 'rape', 'one', 'attempted', 'rape', 'finding', 'guilty', 'count', 'indictment', 'feri', 'also', 'ordered', 'pay', 'total', 'czk', 'financial', 'compensation', 'victim', 'verdict', 'final', 'feri', 'expected', 'appeal', 'prague', 'metropolitan', 'court', 'mp', 'top', 'party', 'feri', 'accused', 'committing', 'two', 'act', 'apartment', 'chamber', 'deputy', 'building', 'two', 'year', 'later']"
 sanjay shah who was arrested in june in dubai where he was living is accused of running a ninebillionkroner billion scam that enabled companies he controlled to fraudulently claim danish tax refunds between and shah has said he is not guilty and did not violate danish law.,Legal and Crime Stories ,['Denmark'],"['sanjay', 'shah', 'arrested', 'june', 'dubai', 'living', 'accused', 'running', 'ninebillionkroner', 'billion', 'scam', 'enabled', 'company', 'controlled', 'fraudulently', 'claim', 'danish', 'tax', 'refund', 'shah', 'said', 'guilty', 'violate', 'danish', 'law', 'face', 'year', 'prison', 'glostrup', 'district', 'court', 'copenhagen', 'find', 'guilty', 'united', 'arab', 'emirate', 'extradited', 'shah', 'denmark', 'december', 'year', 'negotiation', 'included', 'signing', 'extradition', 'treaty', 'two', 'country', 'march', 'prosecution', 'said', 'statement', 'shah', 'used', 'welldesigned', 'organised', 'fraud', 'scheme', 'submit', 'application', 'unlawfully', 'receive', 'nine', 'billion', 'krone', 'dividend', 'tax', 'refund', 'treasury']"
 wnba star brittney griners carried vape cartridges at a moscow airport in february. The examination of the substance contained in vape cartridges did not comply with russian law.,Legal and Crime Stories ,[],"['examination', 'substance', 'contained', 'vape', 'cartridge', 'wnba', 'star', 'brittney', 'griners', 'carried', 'moscow', 'airport', 'february', 'comply', 'russian', 'law', 'defense', 'expert', 'testified', 'tuesday', 'highstakes', 'drugsmuggling', 'trial', 'among', 'violation', 'result', 'examination', 'show', 'amount', 'thc', 'substance', 'griners', 'lawyer', 'maria', 'blagovolina', 'said', 'hearing', 'examination', 'comply', 'law', 'term', 'completeness', 'study', 'comply', 'norm', 'code', 'criminal', 'procedure', 'forensic', 'chemist', 'dmitry', 'gladyshev', 'testified', 'defense', 'roughly', 'twohour', 'session', 'defense', 'also', 'interrogated', 'prosecution', 'expert', 'alexander', 'korablyov', 'examined', 'griners', 'cartridge', 'taken', 'luggage']"
 united nations human rights chief volker turk denounced the rampant hunger and looming famine in gaza in a statement slammed by israel. turk said that the situation of hunger starvation and famine is a result of israels extensive restrictions on the entry and distribution of humanitarian aid and commercial goods.,Legal and Crime Stories| Military,['Israel'],"['un', 'said', 'tuesday', 'mar', 'israel', 'severe', 'restriction', 'aid', 'warravaged', 'gaza', 'coupled', 'military', 'offensive', 'could', 'amount', 'using', 'starvation', 'weapon', 'war', 'would', 'war', 'crime', 'united', 'nation', 'human', 'right', 'chief', 'volker', 'turk', 'denounced', 'rampant', 'hunger', 'looming', 'famine', 'gaza', 'statement', 'slammed', 'israel', 'turk', 'said', 'situation', 'hunger', 'starvation', 'famine', 'result', 'israel', 'extensive', 'restriction', 'entry', 'distribution', 'humanitarian', 'aid', 'commercial', 'good', 'also', 'linked', 'displacement', 'population', 'well', 'destruction', 'crucial', 'civilian', 'infrastructure', 'said']"
 ugandan troops have been fighting in eastern drc since as part of a joint operation to dismantle the allied democratic forces adf. The adf is a militant group affiliated with isis the adf designated a terror group by the united states and uganda.,Legal and Crime Stories| Military,"['Belgium', 'Congo', 'Uganda']","['ugandan', 'troop', 'fighting', 'eastern', 'drc', 'since', 'part', 'joint', 'operation', 'dismantle', 'allied', 'democratic', 'force', 'adf', 'militant', 'group', 'affiliated', 'isi', 'adf', 'designated', 'terror', 'group', 'united', 'state', 'uganda', 'originated', 'uganda', 'operates', 'north', 'kivu', 'carry', 'attack', 'uganda', 'congo', 'although', 'group', 'received', 'less', 'attention', 'least', 'deadly', 'congo', 'expert', 'kristof', 'titeca', 'belgium', 'university', 'antwerp', 'told', 'dw', 'adding', 'joint', 'operation', 'congolese', 'ugandan', 'force', 'particularly', 'effective', 'past', 'six', 'month']"
The village of nzakoundou was the target of a deadly attack attributed to r armed elements on december killing civilians. The village had been burnt down and the rest of the population fled into the bush. The blue helmets of the un mission are progressing towards the village with the aim of reinforcing security.,Legal and Crime Stories| Military,[],"['village', 'nzakoundou', 'target', 'deadly', 'attack', 'attributed', 'r', 'armed', 'element', 'december', 'killing', 'civilian', 'announced', 'un', 'press', 'release', 'adding', 'village', 'burnt', 'rest', 'population', 'fled', 'bush', 'blue', 'helmet', 'un', 'mission', 'central', 'african', 'republic', 'minusca', 'whose', 'number', 'specified', 'progressing', 'towards', 'village', 'aim', 'reinforcing', 'security', 'area', 'facilitating', 'humanitarian', 'access', 'population', 'un', 'mission', 'explained', 'r', 'armed', 'group', 'return', 'reclamation', 'rehabilitation', 'one', 'powerful', 'multitude', 'rebel', 'group', 'criminal', 'gang', 'terrorizing', 'population', 'vast', 'central', 'african', 'country']"
The drone which was launched at the erbil air base by an iranianbacked militia before sunrise on oct penetrated us air defences and crashed into the second floor of the barracks housing american troops. The device laden with explosives failed to detonate and in the end only one service member suffered a concussion from the impact.,Legal and Crime Stories| Military,[],"['drone', 'launched', 'erbil', 'air', 'base', 'iranianbacked', 'militia', 'sunrise', 'oct', 'penetrated', 'u', 'air', 'defence', 'crashed', 'second', 'floor', 'barrack', 'housing', 'american', 'troop', 'according', 'two', 'u', 'official', 'familiar', 'matter', 'device', 'laden', 'explosive', 'failed', 'detonate', 'end', 'one', 'service', 'member', 'suffered', 'concussion', 'impact', 'said', 'official', 'asked', 'remain', 'anonymous', 'speak', 'freely', 'attack', 'u', 'got', 'lucky', 'added', 'drone', 'could', 'caused', 'carnage', 'exploded']"
The fighting in bangui has become increasingly sectarian. The mostly christian militias known as the antibalaka carry out their own violent reprisal attacks on muslim villages.,Legal and Crime Stories| Military,['Oman'],"['brutality', 'seleka', 'gave', 'rise', 'mostly', 'christian', 'militia', 'known', 'antibalaka', 'new', 'militia', 'whose', 'name', 'mean', 'antimachete', 'proceeded', 'carry', 'violent', 'reprisal', 'attack', 'muslim', 'village', 'introducing', 'dangerous', 'sectarian', 'element', 'conflict', 'civilian', 'targeted', 'increasing', 'frequency', 'last', 'december', 'fighting', 'dramatically', 'escalated', 'antibalaka', 'force', 'launching', 'coordinated', 'attack', 'seleka', 'fighter', 'capital', 'city', 'bangui', 'also', 'deliberately', 'targeted', 'muslim', 'civilian', 'including', 'woman', 'child', 'retaliation', 'seleka', 'fighter', 'murdered', 'christian', 'civilian', 'amid', 'increasing', 'sectarian', 'violence', 'around', 'capital', 'international', 'pressure', 'calling', 'step', 'djotodia', 'resigned', 'following', 'month']"
The bomb on ataturk boulevard was the first in ankara since when a spate of deadly attacks gripped the country video afterward showed a renault cargo vehicle parked there windows shattered and doors open amid debris.,Legal and Crime Stories| Military,[],"['statement', 'described', 'bombing', 'suicide', 'attack', 'planned', 'coincide', 'opening', 'parliament', 'carried', 'team', 'linked', 'immortal', 'battalion', 'pkk', 'designated', 'terrorist', 'organisation', 'trkiye', 'united', 'state', 'european', 'union', 'launched', 'insurgency', 'southeast', 'trkiye', 'people', 'killed', 'conflict', 'bomb', 'ataturk', 'boulevard', 'first', 'ankara', 'since', 'spate', 'deadly', 'attack', 'gripped', 'country', 'video', 'afterward', 'showed', 'renault', 'cargo', 'vehicle', 'parked', 'window', 'shattered', 'door', 'open', 'amid', 'debris', 'surrounded', 'soldier', 'ambulance', 'fire', 'truck', 'armoured', 'vehicle']"
The shabab seeks to establish an islamic state in Somalia. The group remains potent even in the face of a largescale americanbacked offensive.,Legal and Crime Stories| Military,"['Bahrain', 'Ethiopia', 'Mali', 'Somalia', 'Ukraine']","['beyond', 'ethiopia', 'threat', 'shabab', 'seek', 'establish', 'islamic', 'state', 'also', 'loom', 'large', 'somalia', 'group', 'remains', 'threat', 'targeting', 'civilian', 'official', 'january', 'shabab', 'captured', 'un', 'helicopter', 'took', 'six', 'passenger', 'including', 'four', 'ukrainian', 'hostage', 'according', 'ukraine', 'foreign', 'ministry', 'group', 'also', 'took', 'responsibility', 'attack', 'month', 'killed', 'four', 'emirati', 'bahraini', 'security', 'officer', 'mogadishu', 'military', 'base', 'shabab', 'remain', 'potent', 'even', 'face', 'largescale', 'americanbacked', 'offensive', 'mr', 'mohamuds', 'administration', 'launched', 'came', 'power', 'group', 'lost', 'territory', 'soldier', 'initial', 'phase', 'campaign', 'central', 'somalia', 'expert', 'somali', 'official', 'say', 'logistical', 'weatherrelated', 'challenge', 'delayed', 'second', 'phase', 'aimed', 'clearing', 'southern', 'somalia', 'abdulkadir', 'mohamed', 'nur', 'country', 'defense', 'minister', 'said', 'interview']"
Dish network left one of its retired satellites floating too low in space and has now been slapped with a fine by federal regulators. Dish settlement marks the first fine ever levied against a company for space debris.,Media and Communication,[],"['dish', 'network', 'left', 'one', 'retired', 'satellite', 'floating', 'low', 'space', 'slapped', 'fine', 'federal', 'regulator', 'federal', 'communication', 'commission', 'fcc', 'issued', 'penalty', 'dish', 'monday', 'saying', 'colorado', 'company', 'didnt', 'properly', 'dispose', 'defunct', 'direct', 'broadcast', 'satellite', 'known', 'echostar', 'dish', 'settlement', 'mark', 'first', 'fine', 'ever', 'levied', 'company', 'space', 'debris', 'fcc', 'official', 'said', 'satellite', 'operation', 'become', 'prevalent', 'space', 'economy', 'accelerates', 'must', 'certain', 'operator', 'comply', 'commitment', 'loyaan', 'egal', 'fcc', 'enforcement', 'bureau', 'chief', 'said', 'statement', 'breakthrough', 'settlement', 'making', 'clear', 'fcc', 'strong', 'enforcement', 'authority', 'capability', 'enforce', 'vitally', 'important', 'space', 'debris', 'rule']"
Twitter users criticized the social network for allowing the grisly images including of a bloodspattered child to spread virally across the platform after the shooting. The unusually graphic nature of the images drew sustained outcry from users and they threw a harsh spotlight on twitters content moderation practices.,media and communication,[],"['family', 'deserve', 'see', 'dead', 'relative', 'spread', 'across', 'twitter', 'everybody', 'see', 'm', 'holloway', 'said', 'interview', 'sunday', 'm', 'holloway', 'one', 'many', 'twitter', 'user', 'criticized', 'social', 'network', 'allowing', 'grisly', 'image', 'including', 'bloodspattered', 'child', 'spread', 'virally', 'across', 'platform', 'shooting', 'saturday', 'though', 'gruesome', 'image', 'become', 'common', 'social', 'medium', 'cellphone', 'camera', 'internet', 'connection', 'make', 'everyone', 'publisher', 'unusually', 'graphic', 'nature', 'image', 'drew', 'sustained', 'outcry', 'user', 'threw', 'harsh', 'spotlight', 'twitter', 'content', 'moderation', 'practice', 'curtailed', 'since', 'mr', 'musk', 'acquired', 'company', 'last', 'year']"
 deutsche bank analyst adam cochrane downgraded inditex and hm to a sell rating citing challenges including price deflation within clothing and pressure from shein and its fastgrowing competitor pddowned temu hm.,Media and Communication,[],"['dec', 'deutsche', 'bank', 'analyst', 'adam', 'cochrane', 'downgraded', 'inditex', 'hm', 'sell', 'rating', 'citing', 'challenge', 'including', 'price', 'deflation', 'within', 'clothing', 'pressure', 'shein', 'fastgrowing', 'competitor', 'pddowned', 'temu', 'hm', 'declined', 'comment', 'sheins', 'market', 'share', 'zara', 'immediately', 'respond', 'request', 'comment', 'sure', 'shein', 'feature', 'common', 'zara', 'hm', 'often', 'credited', 'spearheading', 'concept', 'replicating', 'runway', 'look', 'bringing', 'shopper', 'less', 'also', 'known', 'fastfashion', 'three', 'retailer', 'faced', 'criticism', 'allegedly', 'stealing', 'design', 'brand', 'critic', 'say', 'sheins', 'superfast', 'production', 'cycle', 'make', 'especially', 'egregious', 'offender']"
 british media regulator ofcom will this week push for an antitrust investigation into amazon and microsofts dominance of the uks cloud computing market according to two sources.,Media and Communication,[],"['british', 'medium', 'regulator', 'ofcom', 'week', 'push', 'antitrust', 'investigation', 'amazon', 'microsofts', 'dominance', 'uk', 'cloud', 'computing', 'market', 'according', 'two', 'source', 'familiar', 'matter', 'amazon', 'microsoft', 'enjoy', 'combined', 'market', 'share', 'per', 'cent', 'britain', 'cloud', 'computing', 'industry', 'meanwhile', 'closest', 'competitor', 'alphabet', 'google', 'closer', 'per', 'cent', 'ofcoms', 'push', 'antitrust', 'probe', 'first', 'signalled', 'april', 'remain', 'body', 'final', 'report', 'matter', 'set', 'published', 'thursday', 'one', 'source', 'said', 'watchdog', 'previously', 'said', 'considered', 'referring', 'market', 'investigation', 'cma', 'british', 'competition', 'regulator']"
A former deputy lead of the data management unit set up by the ministry of health moh to combat the covid pandemic leaked the daily number of covid cases to a chat group of people. zhao zheng a yearold singapore citizen was sentenced to weeks jail on tuesday feb.,Media and Communication,['Singapore'],"['former', 'deputy', 'lead', 'data', 'management', 'unit', 'set', 'ministry', 'health', 'moh', 'combat', 'covid', 'pandemic', 'leaked', 'daily', 'number', 'covid', 'case', 'chat', 'group', 'people', 'even', 'offering', 'small', 'prize', 'managed', 'predict', 'figure', 'zhao', 'zheng', 'yearold', 'singapore', 'citizen', 'sentenced', 'week', 'jail', 'tuesday', 'feb', 'pleaded', 'guilty', 'charge', 'mostly', 'wrongful', 'communication', 'information', 'official', 'secret', 'act', 'another', 'charge', 'taken', 'consideration', 'court', 'heard', 'zhao', 'working', 'assistant', 'director', 'biostatistics', 'research', 'branch', 'public', 'health', 'division', 'moh', 'pandemic', 'broke']"
 communist youth league criticise hm for finding faults with xinjiang cotton. Two chinese celebrities who previously represented hm issued statements saying they no longer have any ties with it.,media and communication| consumer topics ,['China'],"['communist', 'youth', 'league', 'ruling', 'communist', 'party', 'organisation', 'young', 'people', 'took', 'weibo', 'wednesday', 'march', 'criticise', 'hm', 'finding', 'fault', 'xinjiang', 'cotton', 'want', 'make', 'money', 'china', 'spreading', 'false', 'rumour', 'boycotting', 'xinjiang', 'cotton', 'wishful', 'thinking', 'said', 'post', 'one', 'people', 'liberation', 'army', 'weibo', 'account', 'called', 'hm', 'statement', 'ignorant', 'arrogant', 'two', 'chinese', 'celebrity', 'previously', 'represented', 'hm', 'issued', 'statement', 'saying', 'longer', 'tie', 'adding', 'oppose', 'attempt', 'smear', 'china', 'united', 'state', 'western', 'government', 'accuse', 'china', 'sending', 'one', 'million', 'muslim', 'uighur', 'internment', 'camp', 'forcing', 'work']"
 washington is targeting individuals and two entities enabling irans uav production including engine types that power irans shahed variant uavs which were used in the apr attack. the united states and the united kingdom announced widespread sanctions against irans military drone program on thursday apr in response to its weekend attack against israel.,Military,['Israel'],"['united', 'state', 'united', 'kingdom', 'announced', 'widespread', 'sanction', 'iran', 'military', 'drone', 'program', 'thursday', 'apr', 'response', 'weekend', 'attack', 'israel', 'washington', 'targeting', 'individual', 'two', 'entity', 'enabling', 'iran', 'uav', 'production', 'including', 'engine', 'type', 'power', 'iran', 'shahed', 'variant', 'uavs', 'used', 'apr', 'attack', 'treasury', 'department', 'said', 'statement', 'referring', 'iran', 'unmanned', 'aerial', 'vehicle', 'program', 'tehran', 'launched', 'firstever', 'direct', 'military', 'attack', 'israel', 'late', 'saturday', 'retaliation', 'apr', 'air', 'strike', 'iranian', 'consulate', 'damascus', 'widely', 'blamed', 'israel', 'killed', 'seven', 'member', 'islamic', 'revolutionary', 'guard', 'corp', 'including', 'two', 'general']"
 south korea is the first country to sanction all the vessels but the new konk and unica the two were sanctioned by the european union in the sanctions also apply to two north koreans.,Military,[],"['south', 'korea', 'first', 'country', 'sanction', 'vessel', 'new', 'konk', 'unica', 'two', 'sanctioned', 'european', 'union', 'sanction', 'also', 'apply', 'two', 'north', 'korean', 'pak', 'kyongran', 'employee', 'korea', 'paek', 'sol', 'trading', 'corp', 'suspected', 'purchasing', 'used', 'vessel', 'bringing', 'refined', 'oil', 'north', 'korea', 'second', 'individual', 'min', 'myonghak', 'executive', 'risang', 'trading', 'allegedly', 'involved', 'sending', 'north', 'korean', 'worker', 'shiptoship', 'transfer', 'along', 'risang', 'trading', 'mangang', 'trading', 'co', 'yua', 'trading', 'designated', 'three', 'entity', 'subject', 'sanction']"
 singapore southeast asia need not worry about an immediate rise in terror attacks or recruitment of foreign fighters. The bigger worry is if afghanistan becomes a failed state under the taliban said indonesian antiterrorism expert noor huda.,Military,"['Afghanistan', 'Indonesia', 'Singapore']","['singapore', 'southeast', 'asia', 'need', 'worry', 'immediate', 'rise', 'terror', 'attack', 'recruitment', 'foreign', 'fighter', 'taliban', 'takeover', 'afghanistan', 'bigger', 'worry', 'afghanistan', 'becomes', 'failed', 'state', 'taliban', 'said', 'indonesian', 'antiterrorism', 'expert', 'noor', 'huda', 'ismail', 'history', 'shown', 'conflict', 'area', 'failed', 'state', 'become', 'fertile', 'ground', 'transnational', 'terrorist', 'organisation', 'like', 'isi', 'al', 'qaeda', 'regroup', 'context', 'southeast', 'asia', 'like', 'jemaah', 'islamiyah', 'ji', 'said', 'noor', 'huda', 'founder', 'institute', 'international', 'peace', 'building', 'indonesia', 'oneonone', 'interview', 'cna', 'ji', 'training', 'camp', 'region', 'restive', 'place', 'linked', 'terrorist', 'attack', 'including', 'bali', 'bombing', 'killed', 'hundred', 'tourist', 'indonesian']"
 russian president vladimir putin sent his army into ukraine in violation of repeated russian assurances against invasion the war was to last a week or two mr putin anticipated a blitzkrieg a rapid victory which would present the west with a fait accompli before the west had time to react. This quickly went awry the russian army bogged down in the outskirts of the ukrainian capital and had to withdraw in the east.,Military,['Ukraine'],"['busan', 'south', 'korea', 'war', 'ukraine', 'reached', 'second', 'anniversary', 'feb', 'russian', 'president', 'vladimir', 'putin', 'sent', 'army', 'ukraine', 'violation', 'repeated', 'russian', 'assurance', 'invasion', 'war', 'last', 'week', 'two', 'mr', 'putin', 'anticipated', 'blitzkrieg', 'rapid', 'victory', 'would', 'present', 'west', 'fait', 'accompli', 'west', 'time', 'react', 'war', 'would', 'west', 'would', 'adjust', 'new', 'fact', 'ground', 'quickly', 'went', 'awry', 'russian', 'army', 'bogged', 'outskirt', 'ukrainian', 'capital', 'withdraw', 'east', 'penetrated', 'along', 'broad', 'front', 'deeply', 'took', 'per', 'cent', 'ukrainian', 'territory', 'importantly', 'reach', 'dnipro', 'river', 'bisects', 'ukraine', 'therefore', 'could', 'approach', 'north', 'atlantic', 'treaty', 'organization', 'nato', 'territory']"
 fighting between myanmars military and ethnic armed groups has rocked the border town of myawaddy this week sending people fleeing into thailand. The recent clashes have raised concerns in bangkok with thai foreign minister parnpree bahiddhanukara visiting the border on friday.,Military,"['Myanmar', 'Thailand']","['fighting', 'myanmar', 'military', 'ethnic', 'armed', 'group', 'rocked', 'border', 'town', 'myawaddy', 'week', 'sending', 'people', 'fleeing', 'thailand', 'boom', 'artillery', 'shell', 'gunfire', 'could', 'heard', 'conflict', 'myanmar', 'sparked', 'military', 'coup', 'regularly', 'sends', 'people', 'rushing', 'across', 'two', 'country', 'shared', 'km', 'border', 'recent', 'clash', 'raised', 'concern', 'bangkok', 'thai', 'foreign', 'minister', 'parnpree', 'bahiddhanukara', 'visiting', 'border', 'friday', 'soldier', 'guarding', 'along', 'border', 'showing', 'ready', 'protect', 'let', 'anyone', 'violate', 'sovereignty', 'told', 'reporter', 'thailand', 'clearly', 'stated', 'allow', 'anyone', 'violate', 'thai', 'soil', 'accept', 'said']"
The prosecutor requested year prison sentences for alfredo h and indrit k in the black eagle case related to a large drug trafficking operation she identified these two albanian nationals as the leaders of the criminal organisation.,Organized Crime and Trafficking ,['Albania'],"['thursday', 'brussels', 'criminal', 'court', 'prosecutor', 'requested', 'year', 'prison', 'sentence', 'alfredo', 'h', 'indrit', 'k', 'black', 'eagle', 'case', 'related', 'large', 'drug', 'trafficking', 'operation', 'identified', 'two', 'albanian', 'national', 'leader', 'criminal', 'organisation', 'responsible', 'drug', 'trafficking', 'operation', 'prosecution', 'evidence', 'includes', 'cocaine', 'seizure', 'conducted', 'throughout', 'investigation', 'launched', 'estimated', 'value', 'million', 'alfredo', 'h', 'pinpointed', 'one', 'operation', 'head', 'found', 'connection', 'italian', 'mafia', 'group', 'established', 'limburg', 'head', 'larger', 'organisation', 'based', 'majorca', 'implemented', 'modern', 'business', 'method', 'sharing', 'resource', 'workforce', 'equipment', 'explained', 'prosecutor']"
Lithuanian car thieves have been a nuisance in estonia for over a decade. aurimas skirgaila is regarded as one of the principal architects of a recent wave of car theft. It is the first time a lithuanian criminal has been convicted of creating a criminal organization.,Organized Crime and Trafficking ,"['Estonia', 'Lithuania']","['secret', 'lithuanian', 'car', 'thief', 'nuisance', 'estonia', 'decade', 'recent', 'conviction', 'aurimas', 'skirgaila', 'regarded', 'one', 'principal', 'architect', 'recent', 'wave', 'car', 'theft', 'estonia', 'tartu', 'county', 'court', 'mark', 'first', 'time', 'lithuanian', 'criminal', 'convicted', 'creating', 'criminal', 'organization', 'estonia', 'south', 'district', 'prosecutor', 'aro', 'siinmaa', 'said', 'proceeding', 'involving', 'lithuanian', 'car', 'thief', 'far', 'four', 'ruling', 'concerning', 'group', 'alone', 'numerous', 'person', 'tie', 'criminal', 'organization', 'proved', 'impossible', 'bring', 'estonia', 'various', 'reason', 'siinmaa', 'said', 'first', 'time', 'light', 'shed', 'success', 'estonian', 'authority', 'leader', 'group', 'found', 'guilty', 'court']"
